ID,Auteur,BnF,IdRef,Naissance (min),Naissance (max),Mort (min),Mort (max),N°,Témoin,Contexte G,Mention,Contexte D,Paragraphe,Partie,Chapitre,Section
s-paul,,,,0001-01-01,0099-01-01,0001-01-01,0099-01-01,6,basnage,"mary, par le propre Curé des parties, en consequence d ’ une Requête presentée à l ’ Official, dans laquelle à la vérité on avoit énoncé qu ’ ils s ’ étoient promis leur foy un mois auparavant, afin d ’ obtenir plus facilement la Dispense des trois Bans qui leur fut accordée ; qu ’ il étoit étrange d ’ entendre l ’ appellant se plaindre d ’ un mal qu ’ il avoit luy-même causé, et venir reprocher une conduite dont il étoit le seul coupable, que toutes ces considerations le ren-doient non recevable à disputer le doüaire à cette veuve, qui avoit toûjours vécu dans une parfaite intelligence avec son mary, qu ’ on ne pouvoit pas dire qu ’ il eût jamais formé la moindre plainte contrelle ; que ses actions passées justifioient l ’ innocence de sa vie, qu ’ elle ne l ’ avoit pas quitté un seul moment pendant sa maladie, l ’ ayant assisté jusqu ’ à la mort, qu ’ elle luy avoit rendu les derniers devoirs avec tout le déplaisir qu ’ on pouvoit attendre d ’ une femme véritablement affligée ; que si sa douleur n ’ avoit pas eu des suites plus longues, l ’ appellant le devoit imputer à ses empressemens ; qu ’ une jeune femme comme elle âgée seulement de vingt-cinq ans chargée d ’ affaires, sans enfans, sans experience, et qui ne prevoyoit point la consequence d ’ un mariage si precipité, se laissa aisément persuader per se imbecilla res est semina, et offert mfirmitati naturali, non leve pondus quod vidua si ; qu ’ enfin elle n ’ avoit rien oublié de ce qu ’ elle devoit à son premier mary pendant sa vie, qu ’ elle attendoit toute preuve au contraire. Mais aprés tout, que quand cette déférence qu ’ elle avoit euë pour les conseils de l ’ appellant ne la rendroit pas entièrement favorable et exempte de faute, il étoit cettain qu ’ une veuve se remariant dans l ’ an du deüil n ’ encouroit point les peines portées par le Droit Civil, lesquelles avoient été corrigées par les Decrets des Papes suivant le conseil de",S. Paul,", et par les Arrests qui permettoient aux femmes de se remarier incontinent aprés la mort de leurs premiers maris, pourvû neanmoms que la confusion du sang, ou l ’ incertitude de l ’ état de l ’ enfant ne se rencontrassent point dans ces secondes nopces, ce qu ’ on ne pouvoit pas reprother à cette veuve, puisqu ’ elle n ’ étoit accouchée que douze mois aprés le décez de son pre-mier mary, que les défenses du Droit ne pouvoient s ’ étendre jusques à empescher la liberté des mariages, peccata interdicit Deus, non matrimonia, qu ’ encores bien que des secondes nopces si precipitées soient en quelque façon honteuses et contre la bien-seance, qu ’ elles n ’ étoient pas pour cela criminelles, qu ’ aussi cette liberté accordée aux veuves de se remarier dans l ’ an du deüil étoit si bien établie, que par Arrest de l ’ année 1648. rapporté dans le premier Tome du Journal des Audiences, on avoit ajugé le doüaire à une veuve qui s ’ étoit comportée impudiquement dans le dixième mois de l ’ an de son deüil avec celuy qui l ’ avoit des puis épousée ; et par un autre Arrest de ce Parlement de l ’ année 1652. une femme qui s ’ éoit remariée quatre mois aprés la mort. de son premier mary, ayant accouché cinq moit treize jours aprés son second mariage, n ’ avoit pas été privée de son doüaire, ce qui faisoit bien voir que les secondes nopces étoient permises en tout temps, et que lors qu ’ on la limité l ’ étoit pour conserver plus d ’ honnêteté dans les mariages ; mais que quand au prejudice de cette regle que la bien-seance feule avoit introduite une femme se remarioit dans l ’ an du seüil, il étoit d ’ une jurisprudence certaine qu ’ elle ne perdoit point son doüaire, que les peines établies par le Droit contre les nopces prematurées avoient été entièrement revoquées par les deux Chapitres cu-dessus citez aux Decret. de Sec. Nupt. sur lesquels les Docteurs avoient agité deux questions, dont la premiere êtoit de sçavoir si la peine étoit remise avec l ’ infamie ; et la seconde, si la veuve n ’ étoit point du moins forcée d ’ attendre quelque temps avant que de passer à un second mariage, et ils ont répondu que non solum Cano. les liberant talem mulierem ab infamia, sed ab omni penâ quam exprimit lex, et statim licet ex quo tempus non adjicitur ; qu ’ en effet on ne devoit pas dire que la veuve n ’ encouroit plus d ’ infamie, mais que la peine subsistoit toûjours, puisque la peine et l ’ infamie sont presque inseparables, et que l ’ une est la marque de l ’ autre, que n ’ y ayant aucun temps prescrit par l ’ Apôtre pour les seconds mariages, il faloit interpreter la permission qu ’ il en donne dans toute son étenduë, jussit juniores viduas nubere, que tous les Auteurs qui avoient traité cette question s ’ étoient soûmis à cette jurisprudence, et étoient d ’ avis qu ’ une femme se remariant dans l ’ an du deüil ne pouvoit être privée de son doüaire : Rebuffe en sa Preface sur l ’ Orlonnance frustra, inquit, de penis fecundo nubentium disputaretur, cum nullae in patriam con-netudinariae observantur. Du Moulin sur le premier Titre de la Coûtume de Paris, au 5. 30. num. 243. pona festinationis matrimonii sunt sublata : Et Antonius Thesaurus en sa Question 18. n. 13. pour appuyer cette même opinion cite un Arrest pour une femme remasiée trente jours aprés la mort de son mary, à laquelle on ajugea son doüaire, et cette dif-position, ajoûte-t ’ il, est d ’ autant plus juste lorsqu ’ il n ’ y a point d ’ enfans du premier mariage, parce qu ’ il faut toûjours presumer que c ’ est plûtost la passion d ’ être mère qui porte une veuve à se remarier que l ’ envie d ’ avoir un mary, non libidinis explendae, sed in spem suscipiendae prolis, Mais qu ’ enfin on pouvoit dire que la femme de l ’ intimé avoit attendu tout le temps ordonné même par les Loix Civiles, la maladie dont son premier mary étoit mort ayant duré plus de treize mois, comme il demeuroit constant par l ’ attestation des Medecins, étant cettain que la viduité qu ’ une femme endure pendant une si longue maladie, est pour le moins aussi penible et difficile à supporter que celle qui suit aprés sa mort","mary, par le propre Curé des parties, en consequence d ’ une Requête presentée à l ’ Official, dans laquelle à la vérité on avoit énoncé qu ’ ils s ’ étoient promis leur foy un mois auparavant, afin d ’ obtenir plus facilement la Dispense des trois Bans qui leur fut accordée ; qu ’ il étoit étrange d ’ entendre l ’ appellant se plaindre d ’ un mal qu ’ il avoit luy-même causé, et venir reprocher une conduite dont il étoit le seul coupable, que toutes ces considerations le ren-doient non recevable à disputer le doüaire à cette veuve, qui avoit toûjours vécu dans une parfaite intelligence avec son mary, qu ’ on ne pouvoit pas dire qu ’ il eût jamais formé la moindre plainte contrelle ; que ses actions passées justifioient l ’ innocence de sa vie, qu ’ elle ne l ’ avoit pas quitté un seul moment pendant sa maladie, l ’ ayant assisté jusqu ’ à la mort, qu ’ elle luy avoit rendu les derniers devoirs avec tout le déplaisir qu ’ on pouvoit attendre d ’ une femme véritablement affligée ; que si sa douleur n ’ avoit pas eu des suites plus longues, l ’ appellant le devoit imputer à ses empressemens ; qu ’ une jeune femme comme elle âgée seulement de vingt-cinq ans chargée d ’ affaires, sans enfans, sans experience, et qui ne prevoyoit point la consequence d ’ un mariage si precipité, se laissa aisément persuader per se imbecilla res est semina, et offert mfirmitati naturali, non leve pondus quod vidua si ; qu ’ enfin elle n ’ avoit rien oublié de ce qu ’ elle devoit à son premier mary pendant sa vie, qu ’ elle attendoit toute preuve au contraire. Mais aprés tout, que quand cette déférence qu ’ elle avoit euë pour les conseils de l ’ appellant ne la rendroit pas entièrement favorable et exempte de faute, il étoit cettain qu ’ une veuve se remariant dans l ’ an du deüil n ’ encouroit point les peines portées par le Droit Civil, lesquelles avoient été corrigées par les Decrets des Papes suivant le conseil de S. Paul, et par les Arrests qui permettoient aux femmes de se remarier incontinent aprés la mort de leurs premiers maris, pourvû neanmoms que la confusion du sang, ou l ’ incertitude de l ’ état de l ’ enfant ne se rencontrassent point dans ces secondes nopces, ce qu ’ on ne pouvoit pas reprother à cette veuve, puisqu ’ elle n ’ étoit accouchée que douze mois aprés le décez de son pre-mier mary, que les défenses du Droit ne pouvoient s ’ étendre jusques à empescher la liberté des mariages, peccata interdicit Deus, non matrimonia, qu ’ encores bien que des secondes nopces si precipitées soient en quelque façon honteuses et contre la bien-seance, qu ’ elles n ’ étoient pas pour cela criminelles, qu ’ aussi cette liberté accordée aux veuves de se remarier dans l ’ an du deüil étoit si bien établie, que par Arrest de l ’ année 1648. rapporté dans le premier Tome du Journal des Audiences, on avoit ajugé le doüaire à une veuve qui s ’ étoit comportée impudiquement dans le dixième mois de l ’ an de son deüil avec celuy qui l ’ avoit des puis épousée ; et par un autre Arrest de ce Parlement de l ’ année 1652. une femme qui s ’ éoit remariée quatre mois aprés la mort. de son premier mary, ayant accouché cinq moit treize jours aprés son second mariage, n ’ avoit pas été privée de son doüaire, ce qui faisoit bien voir que les secondes nopces étoient permises en tout temps, et que lors qu ’ on la limité l ’ étoit pour conserver plus d ’ honnêteté dans les mariages ; mais que quand au prejudice de cette regle que la bien-seance feule avoit introduite une femme se remarioit dans l ’ an du seüil, il étoit d ’ une jurisprudence certaine qu ’ elle ne perdoit point son doüaire, que les peines établies par le Droit contre les nopces prematurées avoient été entièrement revoquées par les deux Chapitres cu-dessus citez aux Decret. de Sec. Nupt. sur lesquels les Docteurs avoient agité deux questions, dont la premiere êtoit de sçavoir si la peine étoit remise avec l ’ infamie ; et la seconde, si la veuve n ’ étoit point du moins forcée d ’ attendre quelque temps avant que de passer à un second mariage, et ils ont répondu que non solum Cano. les liberant talem mulierem ab infamia, sed ab omni penâ quam exprimit lex, et statim licet ex quo tempus non adjicitur ; qu ’ en effet on ne devoit pas dire que la veuve n ’ encouroit plus d ’ infamie, mais que la peine subsistoit toûjours, puisque la peine et l ’ infamie sont presque inseparables, et que l ’ une est la marque de l ’ autre, que n ’ y ayant aucun temps prescrit par l ’ Apôtre pour les seconds mariages, il faloit interpreter la permission qu ’ il en donne dans toute son étenduë, jussit juniores viduas nubere, que tous les Auteurs qui avoient traité cette question s ’ étoient soûmis à cette jurisprudence, et étoient d ’ avis qu ’ une femme se remariant dans l ’ an du deüil ne pouvoit être privée de son doüaire : Rebuffe en sa Preface sur l ’ Orlonnance frustra, inquit, de penis fecundo nubentium disputaretur, cum nullae in patriam con-netudinariae observantur. Du Moulin sur le premier Titre de la Coûtume de Paris, au 5. 30. num. 243. pona festinationis matrimonii sunt sublata : Et Antonius Thesaurus en sa Question 18. n. 13. pour appuyer cette même opinion cite un Arrest pour une femme remasiée trente jours aprés la mort de son mary, à laquelle on ajugea son doüaire, et cette dif-position, ajoûte-t ’ il, est d ’ autant plus juste lorsqu ’ il n ’ y a point d ’ enfans du premier mariage, parce qu ’ il faut toûjours presumer que c ’ est plûtost la passion d ’ être mère qui porte une veuve à se remarier que l ’ envie d ’ avoir un mary, non libidinis explendae, sed in spem suscipiendae prolis, Mais qu ’ enfin on pouvoit dire que la femme de l ’ intimé avoit attendu tout le temps ordonné même par les Loix Civiles, la maladie dont son premier mary étoit mort ayant duré plus de treize mois, comme il demeuroit constant par l ’ attestation des Medecins, étant cettain que la viduité qu ’ une femme endure pendant une si longue maladie, est pour le moins aussi penible et difficile à supporter que celle qui suit aprés sa mort",coutume,DU DOUAIRE.,CCCLXXVII.
s-paul,,,,0001-01-01,0099-01-01,0001-01-01,0099-01-01,1,berault,"Aumariage de la fille ayant accomply vint ans, dautant qu ’ elle esthors de garde, n ’ est requis le conseil et licence du seigneur : mais si auant cet ange on laveut marier il l ’ y faut appeller et luy en communiquer. Et s ’ il ne veut consentir le mariage suitant l ’ aduis des parens, on ne laissera pas de passer outre nonobitant l ’ interest qu ’ il aque la fille ne soit si tost marice parce qu ’ il sera priué de la garde. Car depuis qu ’ elle a attaint son age nubil elle peut etre marièe par le consentement des parens : combien que Platon n ’ approuuoit pas les mariages des personnes si sieunes pour plusieurs causes, ny Aristote non plus, lequel au 7. liure de ses Politiques chap. 16. dit qu ’ il faut regarder en cela que les enfans ne soyent tropéloignez de l ’ age de leurs peres : car alors ils ne peuuent secourir leurs enfans ny les éleuer : ne faut aussi qu ’ ils en approchent trop pour l ’ incommodité qui enreuient en ce que tels enfans reuerent moins leurs peres comme égaux, et la proximité de l ’ age rend contentieuse l ’ oconomie., Par le droit ciuil et canon on estime le mariage valable contracté en la puberté, qui est douze ans accomplis. aux femelles, et quatorze aux masses S. 1. instit. de nupt. et to. tit, de desjons. inipub. extr. tanquam in ca ctate sit potentia coeundi. Et toutesfois comme dit du Moullin aptitudo ad matrimonium non est consideranda respectu potentiae copula duntaxat more brutorum, sed ctiam respectu consilii et iudicii : quia matrimonium non est actus cocuntium sed prudentium, et politica et et conomica capacium non minus quam testamentum., l fin. C. de test, mil. a ussi les loix Romaines ne requeroyent pas feulemet l ’ habilité naturelle des contractans le mariage, mais encor le cosentement des parens, soyent peres ou tuteurs en la puissance desquels ils estoient, et sans lequel consentement les mariages estoyent nuls. Ce consentement suppleoit assez le de ffaut du iugement des enfans : ioint qu ’ il n ’ y auoit tant de danger à leur permettre dé contracter mariage en age si tendre attendu le diuorce qui estoit alors permis. Mais. à present qu ’ être nous le mariage ne se peut dissoudre que par la mort naturelle, il est bien plus obligatoire, et obi maius periculum ibi cautius agendum est. Et si on a trouué dangereux de permettre aux enfans auant vint ans accomplis la dispositio de leurs biens art. 1. tit. de donations, en quoy est comprise la constirution de seruitude l ’ fin. C. de reb, alien, non alien. y a-til pas plus de peril a leur permettre. la disposition de leurs personnes par mariage qui est vnc espèce d ’ alienatione. dautant que les personnes mariees ne sont plus à eux, Non enim vir seu mulier suicorporis habet potestatem,",Paulus,"1. ad Corinth. cap. 7. ou à tout le moins se mettent en vne grande seruitude ; Nemo enim liber est qui corpori seruit, dit Seneque, lib. 4. ep. 93. in fine. Et non multùm à specie seruientium differunt quibus non est libertis recedendi. l. 2. de lib. hom. exhib.","Aumariage de la fille ayant accomply vint ans, dautant qu ’ elle esthors de garde, n ’ est requis le conseil et licence du seigneur : mais si auant cet ange on laveut marier il l ’ y faut appeller et luy en communiquer. Et s ’ il ne veut consentir le mariage suitant l ’ aduis des parens, on ne laissera pas de passer outre nonobitant l ’ interest qu ’ il aque la fille ne soit si tost marice parce qu ’ il sera priué de la garde. Car depuis qu ’ elle a attaint son age nubil elle peut etre marièe par le consentement des parens : combien que Platon n ’ approuuoit pas les mariages des personnes si sieunes pour plusieurs causes, ny Aristote non plus, lequel au 7. liure de ses Politiques chap. 16. dit qu ’ il faut regarder en cela que les enfans ne soyent tropéloignez de l ’ age de leurs peres : car alors ils ne peuuent secourir leurs enfans ny les éleuer : ne faut aussi qu ’ ils en approchent trop pour l ’ incommodité qui enreuient en ce que tels enfans reuerent moins leurs peres comme égaux, et la proximité de l ’ age rend contentieuse l ’ oconomie., Par le droit ciuil et canon on estime le mariage valable contracté en la puberté, qui est douze ans accomplis. aux femelles, et quatorze aux masses S. 1. instit. de nupt. et to. tit, de desjons. inipub. extr. tanquam in ca ctate sit potentia coeundi. Et toutesfois comme dit du Moullin aptitudo ad matrimonium non est consideranda respectu potentiae copula duntaxat more brutorum, sed ctiam respectu consilii et iudicii : quia matrimonium non est actus cocuntium sed prudentium, et politica et et conomica capacium non minus quam testamentum., l fin. C. de test, mil. a ussi les loix Romaines ne requeroyent pas feulemet l ’ habilité naturelle des contractans le mariage, mais encor le cosentement des parens, soyent peres ou tuteurs en la puissance desquels ils estoient, et sans lequel consentement les mariages estoyent nuls. Ce consentement suppleoit assez le de ffaut du iugement des enfans : ioint qu ’ il n ’ y auoit tant de danger à leur permettre dé contracter mariage en age si tendre attendu le diuorce qui estoit alors permis. Mais. à present qu ’ être nous le mariage ne se peut dissoudre que par la mort naturelle, il est bien plus obligatoire, et obi maius periculum ibi cautius agendum est. Et si on a trouué dangereux de permettre aux enfans auant vint ans accomplis la dispositio de leurs biens art. 1. tit. de donations, en quoy est comprise la constirution de seruitude l ’ fin. C. de reb, alien, non alien. y a-til pas plus de peril a leur permettre. la disposition de leurs personnes par mariage qui est vnc espèce d ’ alienatione. dautant que les personnes mariees ne sont plus à eux, Non enim vir seu mulier suicorporis habet potestatem, Paulus 1. ad Corinth. cap. 7. ou à tout le moins se mettent en vne grande seruitude ; Nemo enim liber est qui corpori seruit, dit Seneque, lib. 4. ep. 93. in fine. Et non multùm à specie seruientium differunt quibus non est libertis recedendi. l. 2. de lib. hom. exhib.","COMMENTAIRES SVR LES COVSTVMES DV PAYS DE NORMANDIE, ANCIENS RESSORS ET ENCLAVES D ICELVY.",CHAPITRE DE GARDES.,CCXXVII.
s-paul,,,,0001-01-01,0099-01-01,0001-01-01,0099-01-01,2,berault,"Or le Porcher ne touche à ladite Auurayqu ’ au second degré d ’ affinité, nempé ratione fecundae persona que additur primae. Dauantage dit que les enfans qui estoyent sortis des susdits mariages n ’ estoyent considérables, quia ex co non mutatur genus affinitatis, nec aliud nouum oritur impedimentum, quia affinitas non parit affinitatem, nec transit in secundam vel tertiam personam. Monsieur du Viquet premier aduocat general du Roy remonstre que la prohibition de mariage auec personne qui est en ligne superieure ou ascendente soit de consanguinité ou affinité le rendnù seulement illicite mais detestable. Dauantage faut pressupposer que la police Chre stienne doit auoir plus d ’ honnesteté et de saincteté que celle qui autres fois a resté gardée au paganisme, qui est l ’ argument de repriniende se uere dont auoit ysé",saint Paul,"contre le Corinthien coupable d ’ inceste auec sa belle mere. Il est certain que Papinian a laissé par écrit qu ’ il ne failloit nullement admettre le mariage du gendre auec vne autre femme de son feu beau pere, parce qu ’ elle luy tient et luy a tenu lieu de belle mére. Aussi l ’ honnesteté publique resiste à telle copulation, le seul attentat de laquelle, comme la Cour a entendu par la pleinte des parties, auroit des-ja donné grand scandale és lieux dont elles sont. Et pour cette cause le defendeur dit qu ’ il s ’ est pourueu à Rome ou il a obtenu vn simple rescrit, en l ’ enoncé duquel il auroit demandé derogation à toutes constitutions contraires. Mais le dispositifporte seulement de pourucoir aux parties elles ouyes comme de droit. Ce que l ’ on a pris tout autrement ainsi qu ’ il appert par la sentence portant permission de mariage apres auoir ouy deux personnes n ’ ayans interest en la cause, au lieu que par les saints decrets, mesmes par le droit ciuil de tout tems tels mariages sont prohibez et dure encor ladite prohibition. Parce que, comme le Docteur Canoniste le rapporte sur le chapit. non debet, il n ’ a esté pariceluy rien innoué pour les personnes en ligne directe. Dautant mesmes que laprohibition de droit ciuil au fait dont est question, est fondée sur vne si grand honnesteté qu ’ il ne faut nullement estimer que le Pape l ’ eust voulu abruger.","Or le Porcher ne touche à ladite Auurayqu ’ au second degré d ’ affinité, nempé ratione fecundae persona que additur primae. Dauantage dit que les enfans qui estoyent sortis des susdits mariages n ’ estoyent considérables, quia ex co non mutatur genus affinitatis, nec aliud nouum oritur impedimentum, quia affinitas non parit affinitatem, nec transit in secundam vel tertiam personam. Monsieur du Viquet premier aduocat general du Roy remonstre que la prohibition de mariage auec personne qui est en ligne superieure ou ascendente soit de consanguinité ou affinité le rendnù seulement illicite mais detestable. Dauantage faut pressupposer que la police Chre stienne doit auoir plus d ’ honnesteté et de saincteté que celle qui autres fois a resté gardée au paganisme, qui est l ’ argument de repriniende se uere dont auoit ysé saint Paul contre le Corinthien coupable d ’ inceste auec sa belle mere. Il est certain que Papinian a laissé par écrit qu ’ il ne failloit nullement admettre le mariage du gendre auec vne autre femme de son feu beau pere, parce qu ’ elle luy tient et luy a tenu lieu de belle mére. Aussi l ’ honnesteté publique resiste à telle copulation, le seul attentat de laquelle, comme la Cour a entendu par la pleinte des parties, auroit des-ja donné grand scandale és lieux dont elles sont. Et pour cette cause le defendeur dit qu ’ il s ’ est pourueu à Rome ou il a obtenu vn simple rescrit, en l ’ enoncé duquel il auroit demandé derogation à toutes constitutions contraires. Mais le dispositifporte seulement de pourucoir aux parties elles ouyes comme de droit. Ce que l ’ on a pris tout autrement ainsi qu ’ il appert par la sentence portant permission de mariage apres auoir ouy deux personnes n ’ ayans interest en la cause, au lieu que par les saints decrets, mesmes par le droit ciuil de tout tems tels mariages sont prohibez et dure encor ladite prohibition. Parce que, comme le Docteur Canoniste le rapporte sur le chapit. non debet, il n ’ a esté pariceluy rien innoué pour les personnes en ligne directe. Dautant mesmes que laprohibition de droit ciuil au fait dont est question, est fondée sur vne si grand honnesteté qu ’ il ne faut nullement estimer que le Pape l ’ eust voulu abruger.","COMMENTAIRES SVR LES COVSTVMES DV PAYS DE NORMANDIE, ANCIENS RESSORS ET ENCLAVES D ICELVY.",DE SVCCESSION EN PROPRE ET ANCIEN PATRIMOINE TANT EN ligne directe que collaterale.,CCLXXV.
