ID,Auteur,BnF,IdRef,Naissance (min),Naissance (max),Mort (min),Mort (max),N°,Témoin,Contexte G,Mention,Contexte D,Paragraphe,Partie,Chapitre,Section
s-paul,,,,0001-01-01,0099-01-01,0001-01-01,0099-01-01,1,basnage,"Par les Coûtumes de Boulonnois, Montreüil, et",S. Paul,", il est défendu d ’ aliener les fiefs sinon par necessité jurée par le vendeur et prouvée, et du consentement de ses parens, et du plus proche heritier, ce qui se garde étroitement en Espagne ; Tronçon l. 21.","Par les Coûtumes de Boulonnois, Montreüil, et S. Paul, il est défendu d ’ aliener les fiefs sinon par necessité jurée par le vendeur et prouvée, et du consentement de ses parens, et du plus proche heritier, ce qui se garde étroitement en Espagne ; Tronçon l. 21.",coutume,DES FIEFS ET DROITS FEODAUX,CLXXI. Le fief vendu doit relief et treixième.
s-paul,,,,0001-01-01,0099-01-01,0001-01-01,0099-01-01,2,basnage,"On demeure d ’ accord que Romulus fut l ’ Auteur de cette Loy qui défendoit aux veuves de se matier dans l ’ an de leur viduité ; il est vray que du temps de ce Prince l ’ année n ’ étoit Theodose que de dix mois lunaires. Les Empereurs Gratian, Valentinien, et Theodose I. ordonnerent que la défense de se marier dureroit pendant douze mois, l. 2. C. de Nuptiis ; mais comme cette Loy de Romulus n ’ imposoit aucune peine aux veuves qui la violoient, on les nota d ’ infamie par l ’ Edit du Preteur, et depuis les Empereurs y ajoûterent encore d ’ autres peines, et notamment elles furent privées de tous les bien-faits qu ’ elles avoient reçûs de leurs premiers tie maris. Justinien leur ôta expressément Sbonsalitiam largitatem, ce que quelques-uns voulant ppliquer à nôtre doüaire, Mr Cujas a fait voir leur erreur, ayant marqué la difference par a définition de l ’ un et de l ’ autre, Observ. l. 5. c. 4. Les Papes Urbain. et Innocent III. changerent cette jurisprudence sur la fin du douzième siecle, c. penult. et ult. de 2. Nupt. aux Decret. de sorte que ce n ’ est plus une question parmy nous, qu ’ une veuve n ’ est point coupable de se remarier dans l ’ an du deüil pourvû qu ’ elle ne soit point enceinte : Les Loix Ro-maines qui punissent ces mariages precipitez n ’ ont plus d ’ autorité, elles ne sont observées que dans les Parlemens de Languedoc et de Provence, et le Droit Canonique a prevalu dans les autres, parce qu ’ il paroissoit fondé sur l ’ autorité de",S. Paul,", Chap. 3. Epist. Ad Corinth. uxor alligata est lege, quamdiu vivit vir ipsius ; quod si obdormierit libera est ut cui velit nubat tantùm in Domino. Duaren estimoit, comme le témoigne Mornac l. 11. de his qui notantur infamiâ, que les Canonistes avoient mal compris S. Paul, et donné une mauvaise explication à ses paroles.","On demeure d ’ accord que Romulus fut l ’ Auteur de cette Loy qui défendoit aux veuves de se matier dans l ’ an de leur viduité ; il est vray que du temps de ce Prince l ’ année n ’ étoit Theodose que de dix mois lunaires. Les Empereurs Gratian, Valentinien, et Theodose I. ordonnerent que la défense de se marier dureroit pendant douze mois, l. 2. C. de Nuptiis ; mais comme cette Loy de Romulus n ’ imposoit aucune peine aux veuves qui la violoient, on les nota d ’ infamie par l ’ Edit du Preteur, et depuis les Empereurs y ajoûterent encore d ’ autres peines, et notamment elles furent privées de tous les bien-faits qu ’ elles avoient reçûs de leurs premiers tie maris. Justinien leur ôta expressément Sbonsalitiam largitatem, ce que quelques-uns voulant ppliquer à nôtre doüaire, Mr Cujas a fait voir leur erreur, ayant marqué la difference par a définition de l ’ un et de l ’ autre, Observ. l. 5. c. 4. Les Papes Urbain. et Innocent III. changerent cette jurisprudence sur la fin du douzième siecle, c. penult. et ult. de 2. Nupt. aux Decret. de sorte que ce n ’ est plus une question parmy nous, qu ’ une veuve n ’ est point coupable de se remarier dans l ’ an du deüil pourvû qu ’ elle ne soit point enceinte : Les Loix Ro-maines qui punissent ces mariages precipitez n ’ ont plus d ’ autorité, elles ne sont observées que dans les Parlemens de Languedoc et de Provence, et le Droit Canonique a prevalu dans les autres, parce qu ’ il paroissoit fondé sur l ’ autorité de S. Paul, Chap. 3. Epist. Ad Corinth. uxor alligata est lege, quamdiu vivit vir ipsius ; quod si obdormierit libera est ut cui velit nubat tantùm in Domino. Duaren estimoit, comme le témoigne Mornac l. 11. de his qui notantur infamiâ, que les Canonistes avoient mal compris S. Paul, et donné une mauvaise explication à ses paroles.",coutume,DU DOUAIRE.,CCCLXXVII.
s-paul,,,,0001-01-01,0099-01-01,0001-01-01,0099-01-01,3,basnage,"On demeure d ’ accord que Romulus fut l ’ Auteur de cette Loy qui défendoit aux veuves de se matier dans l ’ an de leur viduité ; il est vray que du temps de ce Prince l ’ année n ’ étoit Theodose que de dix mois lunaires. Les Empereurs Gratian, Valentinien, et Theodose I. ordonnerent que la défense de se marier dureroit pendant douze mois, l. 2. C. de Nuptiis ; mais comme cette Loy de Romulus n ’ imposoit aucune peine aux veuves qui la violoient, on les nota d ’ infamie par l ’ Edit du Preteur, et depuis les Empereurs y ajoûterent encore d ’ autres peines, et notamment elles furent privées de tous les bien-faits qu ’ elles avoient reçûs de leurs premiers tie maris. Justinien leur ôta expressément Sbonsalitiam largitatem, ce que quelques-uns voulant ppliquer à nôtre doüaire, Mr Cujas a fait voir leur erreur, ayant marqué la difference par a définition de l ’ un et de l ’ autre, Observ. l. 5. c. 4. Les Papes Urbain. et Innocent III. changerent cette jurisprudence sur la fin du douzième siecle, c. penult. et ult. de 2. Nupt. aux Decret. de sorte que ce n ’ est plus une question parmy nous, qu ’ une veuve n ’ est point coupable de se remarier dans l ’ an du deüil pourvû qu ’ elle ne soit point enceinte : Les Loix Ro-maines qui punissent ces mariages precipitez n ’ ont plus d ’ autorité, elles ne sont observées que dans les Parlemens de Languedoc et de Provence, et le Droit Canonique a prevalu dans les autres, parce qu ’ il paroissoit fondé sur l ’ autorité de S. Paul, Chap. 3. Epist. Ad Corinth. uxor alligata est lege, quamdiu vivit vir ipsius ; quod si obdormierit libera est ut cui velit nubat tantùm in Domino. Duaren estimoit, comme le témoigne Mornac l. 11. de his qui notantur infamiâ, que les Canonistes avoient mal compris",S. Paul,", et donné une mauvaise explication à ses paroles.","On demeure d ’ accord que Romulus fut l ’ Auteur de cette Loy qui défendoit aux veuves de se matier dans l ’ an de leur viduité ; il est vray que du temps de ce Prince l ’ année n ’ étoit Theodose que de dix mois lunaires. Les Empereurs Gratian, Valentinien, et Theodose I. ordonnerent que la défense de se marier dureroit pendant douze mois, l. 2. C. de Nuptiis ; mais comme cette Loy de Romulus n ’ imposoit aucune peine aux veuves qui la violoient, on les nota d ’ infamie par l ’ Edit du Preteur, et depuis les Empereurs y ajoûterent encore d ’ autres peines, et notamment elles furent privées de tous les bien-faits qu ’ elles avoient reçûs de leurs premiers tie maris. Justinien leur ôta expressément Sbonsalitiam largitatem, ce que quelques-uns voulant ppliquer à nôtre doüaire, Mr Cujas a fait voir leur erreur, ayant marqué la difference par a définition de l ’ un et de l ’ autre, Observ. l. 5. c. 4. Les Papes Urbain. et Innocent III. changerent cette jurisprudence sur la fin du douzième siecle, c. penult. et ult. de 2. Nupt. aux Decret. de sorte que ce n ’ est plus une question parmy nous, qu ’ une veuve n ’ est point coupable de se remarier dans l ’ an du deüil pourvû qu ’ elle ne soit point enceinte : Les Loix Ro-maines qui punissent ces mariages precipitez n ’ ont plus d ’ autorité, elles ne sont observées que dans les Parlemens de Languedoc et de Provence, et le Droit Canonique a prevalu dans les autres, parce qu ’ il paroissoit fondé sur l ’ autorité de S. Paul, Chap. 3. Epist. Ad Corinth. uxor alligata est lege, quamdiu vivit vir ipsius ; quod si obdormierit libera est ut cui velit nubat tantùm in Domino. Duaren estimoit, comme le témoigne Mornac l. 11. de his qui notantur infamiâ, que les Canonistes avoient mal compris S. Paul, et donné une mauvaise explication à ses paroles.",coutume,DU DOUAIRE.,CCCLXXVII.
s-paul,,,,0001-01-01,0099-01-01,0001-01-01,0099-01-01,4,basnage,"Les Loix Romaines qui se pratiquoient alors ayant si hautement étably l ’ honnéteté publique, et ayant interdit aux veuves le retour au mariage pendant un certain temps pour satisfaire à l ’ honneur et à l ’ amitié conjugale, on ne doit point se persuader que ce grand Apôtre eût voulu renverser un usage si conforme à l ’ honnêteté publique, et qui étoit observé dans tout ce vaste Empire, et il n ’ ignoroit pas que Caligula qui avoit entrepris de cortompre toutes les bonnes moeurs venoit de publier un Edit, par lequel il permettoit à toutes les veuves de se remarier, en affirmant qu ’ elles n ’ étoient point enceintes ; de sorte, dit Duaren, que l ’ intention de",S. Paul,"n ’ étoit pas de s ’ opposer à l ’ execution des Loix Romaines, ny d ’ autoriser la eu icence en permettant des nopces si precipitées, et qui auroient infailliblement causé du scandale parmy les Payens : Il vouloit seulement enseigner que les secondes nopces étoient per-mises, ce qui paroit par ces paroles ias di xoitanbù à asûp aornc iMGi et Scu d Wiaus vaunxucas aovor ir xupio, c ’ est à dire qu ’ il avoit bien permis à la veuve de contracter un second mariage, mais il ne l ’ avoit pas dispensée des regles de la bien-seance et de l ’ honnêteté, comme il l ’ auroit fait s ’ il leur avoit donné cette licence de passer sans aucun intervalle de la pompe funebre à la pompe nuptiale ; et pour prouver cette vérité, l ’ Apôtre n ’ avoit pas dit qu ’ elle pouvoit se marier Sûas diMd quand elle voudra, mais o dind à qui elle voudra Mais quand on s ’ attacheroit tout à fait à la disposition du Droit Canonique, et que ce ne seroit plus une faute à une femme de se rematier dans l ’ an du deüil, il y a neanmoins toûours quelque bien-seance à garder. Bien que la mort rompe en un moment le lien du mar riage, il n ’ est pas pourtant de l ’ honnéêtété qu ’ elle efface si promptement tout le souvenir d ’ une si fainte union, et un même tombeau ne doit pas enfermer et la personne et l ’ amitié que les conjoints s ’ étoient voüée : La veuve donc doit laisser écouler quelque intervalle de temps. raisonnable pour essuyer ses larmes, sur tout si son mary l ’ a engagée par ses bien-faits à res specter sa mémoire, comme il fut jugé en une Cause où je plaidois pour Jacques Julien, mary de Marie Behot : Cette femme avoit épousé en premteres nopces Pierre Vastel, qui luy donna ous ses meubles par son Testament, et s ’ étant remariée à Jacques Julien vingt-cinq jours aprés la mort de son mary, Guillaume Vastel frete et heritier du premier mary, soûtint qu ’ elle s ’ étoit renduë indigne de son doüaire et de son legs par un mariage si precipité : L ’ affaire pottée en la Cour sur des appellations incidentes, Maurry pour Vastel s ’ appuyoit sur l ’ au-torité des Loix Romaines, et qu ’ encore qu ’ on ne les pratiquât pas dans la derniere severité, neanmoins une precipitation si extraordinaire ne pouvoit demeurer impunie. Jrexcusois la precipitation de ce mariage par cette raison, qu ’ elle y avoit été engagée par la necessité d ’ éviter un party desavantageux auquel des personnes puissantes la vouloient engager ; Theodose qu ’ aprés tout les Loix Romaines, particulièrement les Constitutions des Empereurs Gratian, Valentinien, et Theodose, avoient été faites sur des motifs qui ne subsistoient plus, car bien que dans le siecle de ces Empereurs les secondes nopces ne fussent pas condamnées, elles n ’ étoient pas neanmoins beaucoup approuvées, comme ce passage de Saint dièrôme le prouve, fecundas nuptias concedimus, sed non appetimus, et c ’ est pourquoy on leur imposoit de si dures conditions ; mais dans les siecles suivans ces scrupules s ’ étant effacez, on n ’ a plus traité si rigoureusement les femmes qui se remarioient dans l ’ an de leur deuil, pourvû qu ’ il ne se rencontrât point de confusion de sang, que c ’ étoit la doctrine de tous les Parlemens du Royaume, à la réserve de ceux de Tolose et d ’ Aix, ce qui étoit confirmé par du Moulin sur le Titre des Fiefs, que hodie mulier nubens infra annum luctis non perdit sibi à marito relicta, nec ex capite ingratitudinis quia pena festinationaes matrimonii sunt sublatae : Par Arrest en l ’ Audience de la Grand-Chambre du 5. de Mars 1649. on priva la femme de la donation testamentaire à cause du peu de temps qui se rencontroit entre la à mort du mary et le deuxième mariage, qui n ’ étoit que de vingt-six jours ; mais on ne luy ôta pas son doüaire.","Les Loix Romaines qui se pratiquoient alors ayant si hautement étably l ’ honnéteté publique, et ayant interdit aux veuves le retour au mariage pendant un certain temps pour satisfaire à l ’ honneur et à l ’ amitié conjugale, on ne doit point se persuader que ce grand Apôtre eût voulu renverser un usage si conforme à l ’ honnêteté publique, et qui étoit observé dans tout ce vaste Empire, et il n ’ ignoroit pas que Caligula qui avoit entrepris de cortompre toutes les bonnes moeurs venoit de publier un Edit, par lequel il permettoit à toutes les veuves de se remarier, en affirmant qu ’ elles n ’ étoient point enceintes ; de sorte, dit Duaren, que l ’ intention de S. Paul n ’ étoit pas de s ’ opposer à l ’ execution des Loix Romaines, ny d ’ autoriser la eu icence en permettant des nopces si precipitées, et qui auroient infailliblement causé du scandale parmy les Payens : Il vouloit seulement enseigner que les secondes nopces étoient per-mises, ce qui paroit par ces paroles ias di xoitanbù à asûp aornc iMGi et Scu d Wiaus vaunxucas aovor ir xupio, c ’ est à dire qu ’ il avoit bien permis à la veuve de contracter un second mariage, mais il ne l ’ avoit pas dispensée des regles de la bien-seance et de l ’ honnêteté, comme il l ’ auroit fait s ’ il leur avoit donné cette licence de passer sans aucun intervalle de la pompe funebre à la pompe nuptiale ; et pour prouver cette vérité, l ’ Apôtre n ’ avoit pas dit qu ’ elle pouvoit se marier Sûas diMd quand elle voudra, mais o dind à qui elle voudra Mais quand on s ’ attacheroit tout à fait à la disposition du Droit Canonique, et que ce ne seroit plus une faute à une femme de se rematier dans l ’ an du deüil, il y a neanmoins toûours quelque bien-seance à garder. Bien que la mort rompe en un moment le lien du mar riage, il n ’ est pas pourtant de l ’ honnéêtété qu ’ elle efface si promptement tout le souvenir d ’ une si fainte union, et un même tombeau ne doit pas enfermer et la personne et l ’ amitié que les conjoints s ’ étoient voüée : La veuve donc doit laisser écouler quelque intervalle de temps. raisonnable pour essuyer ses larmes, sur tout si son mary l ’ a engagée par ses bien-faits à res specter sa mémoire, comme il fut jugé en une Cause où je plaidois pour Jacques Julien, mary de Marie Behot : Cette femme avoit épousé en premteres nopces Pierre Vastel, qui luy donna ous ses meubles par son Testament, et s ’ étant remariée à Jacques Julien vingt-cinq jours aprés la mort de son mary, Guillaume Vastel frete et heritier du premier mary, soûtint qu ’ elle s ’ étoit renduë indigne de son doüaire et de son legs par un mariage si precipité : L ’ affaire pottée en la Cour sur des appellations incidentes, Maurry pour Vastel s ’ appuyoit sur l ’ au-torité des Loix Romaines, et qu ’ encore qu ’ on ne les pratiquât pas dans la derniere severité, neanmoins une precipitation si extraordinaire ne pouvoit demeurer impunie. Jrexcusois la precipitation de ce mariage par cette raison, qu ’ elle y avoit été engagée par la necessité d ’ éviter un party desavantageux auquel des personnes puissantes la vouloient engager ; Theodose qu ’ aprés tout les Loix Romaines, particulièrement les Constitutions des Empereurs Gratian, Valentinien, et Theodose, avoient été faites sur des motifs qui ne subsistoient plus, car bien que dans le siecle de ces Empereurs les secondes nopces ne fussent pas condamnées, elles n ’ étoient pas neanmoins beaucoup approuvées, comme ce passage de Saint dièrôme le prouve, fecundas nuptias concedimus, sed non appetimus, et c ’ est pourquoy on leur imposoit de si dures conditions ; mais dans les siecles suivans ces scrupules s ’ étant effacez, on n ’ a plus traité si rigoureusement les femmes qui se remarioient dans l ’ an de leur deuil, pourvû qu ’ il ne se rencontrât point de confusion de sang, que c ’ étoit la doctrine de tous les Parlemens du Royaume, à la réserve de ceux de Tolose et d ’ Aix, ce qui étoit confirmé par du Moulin sur le Titre des Fiefs, que hodie mulier nubens infra annum luctis non perdit sibi à marito relicta, nec ex capite ingratitudinis quia pena festinationaes matrimonii sunt sublatae : Par Arrest en l ’ Audience de la Grand-Chambre du 5. de Mars 1649. on priva la femme de la donation testamentaire à cause du peu de temps qui se rencontroit entre la à mort du mary et le deuxième mariage, qui n ’ étoit que de vingt-six jours ; mais on ne luy ôta pas son doüaire.",coutume,DU DOUAIRE.,CCCLXXVII.
s-paul,,,,0001-01-01,0099-01-01,0001-01-01,0099-01-01,5,basnage,"On a crû qu ’ un an étoit le moins qu ’ une femme pouvoit donner à la mémoire de son mary, que c ’ étoit blesser la pudeur et la reverence qu ’ on doit au public, et faire un aveu d ’ une incontinence honteuse : qu ’ on ne devoit point opposer le Chapitre penultième et dernier, de fecundis Nuptiis, aux Decretales, parce que le Pape n ’ avoit pû abroger les peines établies par les Loix, que ce seroit passer les limites dans une chose où il n ’ est pas absolu ; en effet il ne la pas entrepris, et il est aisé de voir par ces deux Chapitres qu ’ il n ’ a ôté que l ’ infamie, infamia, disent-ils, aboletur, c ’ est le sentiment de M ’ Cujas sur la l. 1. au C. de secundis Nuptiisi et du Moulin sur le même Titre, appelle l ’ opinion contraire errorem Canonistarum.",S. Paul,"a bien dit nubat, mais il ajoûte in Domino, il faut que le mariage se fasse dans les voyes legitimes. Jesus Christ n ’ a point de part à ces mariages qui se font contre l ’ honnêteté publi-que, et n ’ autorise point ce libertinage effrené. Bérault, sur l ’ Article 377. en rapporte un Arest ; l ’ Auteur de la Bibliotheque du Droit François en rapporte jusqu ’ à douze Arrests du Parlement de Tolofe qui autorisent cette jurisprudence ; et il y en a un de ce Parlement du 22. de Février 1666. au Rapport de Mr de Vigneral, posterieur à tous ceux-cy, par lequel on imposa cette peine aux femmes ingrates et sans pudeur, que même pendant la maladie de on mary elle ne l ’ avoit pas assisté, et qu ’ elle n ’ avoit fait venir des medecins que pour s ’ assuter par leur témoignage qu ’ il n ’ en échaperoit point ; que Justinien en la Novelle 39. u Chapître 2. de restitutionibus, en apporte cette raison, ne qua prastiterit suspicionis maligna causa parce qu ’ un si grand empressement donne de justes soupçons d ’ une conduite criminelle du vivant du mary","On a crû qu ’ un an étoit le moins qu ’ une femme pouvoit donner à la mémoire de son mary, que c ’ étoit blesser la pudeur et la reverence qu ’ on doit au public, et faire un aveu d ’ une incontinence honteuse : qu ’ on ne devoit point opposer le Chapitre penultième et dernier, de fecundis Nuptiis, aux Decretales, parce que le Pape n ’ avoit pû abroger les peines établies par les Loix, que ce seroit passer les limites dans une chose où il n ’ est pas absolu ; en effet il ne la pas entrepris, et il est aisé de voir par ces deux Chapitres qu ’ il n ’ a ôté que l ’ infamie, infamia, disent-ils, aboletur, c ’ est le sentiment de M ’ Cujas sur la l. 1. au C. de secundis Nuptiisi et du Moulin sur le même Titre, appelle l ’ opinion contraire errorem Canonistarum. S. Paul a bien dit nubat, mais il ajoûte in Domino, il faut que le mariage se fasse dans les voyes legitimes. Jesus Christ n ’ a point de part à ces mariages qui se font contre l ’ honnêteté publi-que, et n ’ autorise point ce libertinage effrené. Bérault, sur l ’ Article 377. en rapporte un Arest ; l ’ Auteur de la Bibliotheque du Droit François en rapporte jusqu ’ à douze Arrests du Parlement de Tolofe qui autorisent cette jurisprudence ; et il y en a un de ce Parlement du 22. de Février 1666. au Rapport de Mr de Vigneral, posterieur à tous ceux-cy, par lequel on imposa cette peine aux femmes ingrates et sans pudeur, que même pendant la maladie de on mary elle ne l ’ avoit pas assisté, et qu ’ elle n ’ avoit fait venir des medecins que pour s ’ assuter par leur témoignage qu ’ il n ’ en échaperoit point ; que Justinien en la Novelle 39. u Chapître 2. de restitutionibus, en apporte cette raison, ne qua prastiterit suspicionis maligna causa parce qu ’ un si grand empressement donne de justes soupçons d ’ une conduite criminelle du vivant du mary",coutume,DU DOUAIRE.,CCCLXXVII.
