ID,Auteur,BnF,IdRef,Naissance (min),Naissance (max),Mort (min),Mort (max),N°,Témoin,Contexte G,Mention,Contexte D,Paragraphe,Partie,Chapitre,Section
cicero,Cicéron (0106-0043 av. J.-C.),http://data.bnf.fr/ark:/12148/cb11885977m,http://www.idref.fr/02665234X/id,-0106,-0106,-0043,-0043,6,terrien,"VANs entreprins de traiter du droict des Normas, à bonne cause nous auons commencé nostre oeuure par le tiltre de Droict etde Iustice, et par la diffinition de Droict sainsi qu ’ a fait l ’ Empereur Justinian en l ’ oeuure de ses Pandectes ou Digestesy, suyvant la doctrine de Ciceron, qui dit au commencement de ses Offices, Omnis que à ratione suscipitur de aliqua re disputatio, debet à diffinitione proficisci, vt intelligatur quid sit id de quo disputatur. Ce qui a esté suyui par ceeluy qui a recueilli et redigé par escrit nostre Coustume, quiconque fut-il. Lequel pourautant que ce mot de Droict a plusieurs significations, pourquoy ne le pouuoir bonnement diffinir en general, a iceluy expliqué par diuision. disant que l ’ vn est droict naturel, et l ’ autre est establi. Mais on pourroit de prime face blasmer ceste diuision, comme inparfaicte et moins que suffisante, et ne respondante à celle des anciens Conseillers de droict : lesquels ont diuisé le Droict en trois parties, cest à sçauoir en droict naturel, droict des gens, et droict ciuil : diffinissans le droict naturel en estre celuy que nature a enseigné à tous animaux, et n ’ appartenir pas tant seulement au gen
      re humain : le droict des gens estre celuy qui est gardé esgalement entre tous les hommes, appellé droict des gens, comme celuy dont usent toutes gens et nations humaines : et le droict ciuil estre celuy que chacun Peuple, ou chacune Cité, et Contree a establi pour soy, et pour son vtilité, ainsi appelé comme droict propre et particulier de chacune cité. a quoy ie respon pour sauuer ce blasme, quel ’ autheur ou conpilateur de nostre Coustume a comprins le droict des gens sous le droict naturel, comme descendant d ’ iceluy. Ce qu ’ il ne fait pas sans raison. Car les Conseillers de droict ont aussi appelé le droict des gens, droict naturel, comme celuy que la raisonnaturelle à establi entre tous les hommes. Et de faict on voit que ce que nostre texte attribue au droict naturel, est attribué au droict des gens par iceux Conseillers de droict, scilicet erga Deis reli gio : er parentibus obediamus, ac nefas esse homine homini insidiari. Lequel dernier poinct Ciceron a dit estre de droict naturel, au troisiesme de ses Offices, escriuant ainsi : Sihoc natura praeeribit, ot homo homini quicique sit, ob cam causam quod homo sit, consultù velitenecesse est secundi eam naturan, utilitate omnium effe communem. Quod siita est, una continétur omnes et eade lege nature. Idque ipsum si ita est, certeviolare alteris naturae lege prohibetur. Nous appelerons doncques le droict des gens, lus naturale secundarii. : et l ’ autre primariis aut primauum. Pour venir à la diffinition duquel, nous dirons par le texte de nostre Coustume, conformement à ce qu ’ en ont escrit les Philosophes et Theologiens, Que c ’ et proprement l ’ impression de la diuine lumière en la creature raisonnable, c ’ est à dire les intelligences et cognoissances engrauees en notre ame, qui nous induisent à suiure iustice, et fuir iniustice. Desquelles cognoissances comme de certains Principes dont le sens humain est preuenu et informé de nature, sans doctrine d ’ homme, nous tirons des conclusions, qui en procedent par bonne et necessaire conséquence, touchant les oeuures et actions requises et conuenables pour conseruer et entretenir la société, charité et coniunction humaine. De ce droict Ciceron a escrit ceste diuine sentence en son liure des loix. Sed comnium que in hominum doctorum disputatione versantur, nihil est profecto prestabilius, quam plane intelligi nos ad iustitiam esse natos : neque opinione, sed natura constitutum efse ius. Ce droict naturel est appelé Loy denature par iceluy Ciceron au lieu cy dessus extrait du troisiesme de ses Offices. a quoy s accorde ce qu ’ a escrit S. Paul au :. chap. de son epistre aux Romains, en cestemanière, cûm enim gentes que legem non habent, naturaliter ea que legis sunt, faciunt, he legem non habentes sibi ipsis sunt lex : qui ostendunt opus legis scriptum in cordibus suis. Ledit",Ciceron,"l ’ appelle aussi Raison souvueraine, et Raison naturelle, disant audit liure des loix, Lex estratio summa insita à natura, que iubet ea que facienda sunt, prohibétque contraria. Outreplus il l ’ appelle Loy eternelle, escriuant ainsi : Hanc igitur video sapientisimorum fuisse sententiam, legem neque hominum inoeniis excogitatam, neque scitum aliquod esse popiilorum : sed xternum quiddam quod oniuersum mundum regeret, imperandi, prohibendique sapientia. Ita principem legem illam et oltimam, mentem esse dicebant omnia ratione. cogentis, aut vetantis Dei, ex qua illa lex quam dij humano generi dederune, recte laudata est, est enim ratio, mensque sapientis, ad iubenaum et ad deterrendum idonca. Il appelle doncques loy eternelle la raison commune infuse en la nature humaine, comme quelque part et portion de diuinité. a ce propos conuiët assez ce qu ’ a escrit Paul le Iurisconsulte, Quod ratio naturalis est tacita quedam lex. Et si on obiecte, qu ’ à ce que dessus s ’ accorde mal la diffinition du droict naturel, baillee par Ulpian, sçauoir ests Quod ius naturaleest quod natura omnia animalia docuit : d ’ autant que les bestes brutes ne sont capables ne participantes de raison : Nous respondrons qu ’ à la verité ce qu ’ auons cy dessus escrit, s ’ entend proprement du droict humain, et qui n ’ a lieu qu ’ entre les hommes : lequel est mieux exprimé par ce mot Droict, respondant au mot Latin. Rectum, que par ce mot Ius. Pource que par ce mot Droict, ne peut estre entendu, siné ce qui est bon, iuste et equitable, et reiglé par droite raison, ne déclinant à dextre n ’ a senestre. Mais en la diffinition dessusdite, lus naturale, signifie la vertu et puissance naturelle commune à tous animaux, qui les incline à la conseruation et defence de leur vie, à se conioindre ensemble à fin de generation, et auoir soin et souci de nourrir et essleuer leur geniture, pour perpetuer leurs especes. De ceste puissance naturelle a dit Pline parlant de la Tygre beste trescruelle entre les autres : laquelle par la premiere veué de l ’ homme, ou de ses pas est incitee à transporter ses faons, Nimirum hec naturae et rerum hec potentia cius, sauissimas ferarum maximasque que nunquam vidissent, quod debcant timere, statim intelligere cur sit timendum. Et combien qu ’ és animaux autres que les hommes, n ’ y ait parfaite raison, par laquelle ils puissent discourir, et tirer les conclusions qui s ’ ensuyuent des principes et causes de toutes choses, auoir memoire du passé, pourueoir et doner ordre aux choses presentes, et preueoir les futures, et auoir discretion du bien et du mal : toutesfois nous en voyons plusieurs, qui sont pourueus, et douez de gran de intelligence, et reluire en eux des exemples de vertu. Comme le formi, qui est creé auec telle prouidence naturelle, que Salomon n ’ a fait doute de renuoyer l ’ homme à ceste petite bestiole, pour apprendre sapience. La cigongne est apprinse de nature à nourrir pere et mere en leur vieillesse, leur rendant la pareille de ce qu ’ elle a receu d ’ eux en son enfance. La nature admirable et proprieté de mouches à miel, l ’ ingenieux artifice de leurs maisonnettes de cire, leurs polices, et l ’ obeissance qu ’ ils portent à leur Roy, a contraint Virgile d ’ escrire, esse apibus partè diuine mentis, et haustus Aethereos. Pline escrit de l ’ Elephant, le plus grand des animaux terrestres, qu ’ il approche fort du sens humain, entend la langue de son pays, y a en luy docilité, obeissance, mémoire du seruice qu ’ il doit, probité, prudence, equité, clemence, veneration du soleil et de la lune : de sorte qu ’ ainsi qu ’ il le paint, il semble ne luy manquer de ce qui appartient à l ’ homme, et que la parole, et la figure humaine. Veu lesquels exemples et autres infinis qu ’ on pourroit alléguer, ce n ’ est de merueille si Plutarque a escrit son petit traité, An brutis ratio insit. Mesme Lactance Philosophe Chrestien a osé affermer au troisiesme liure des diuines institutions, Que les choses qu ’ on estime estre propres et particulieres à l ’ homme, sont communes aussi aux autres animaux : et que raison leur a esté donee, autant seulement qu ’ il est requis pour la tuition et defence de leur vie. Mais à l ’ homme a esté donnée parfaite raison, appelée Sapiomce : qui rend l ’ homme singulier, et surpassant les autres animaux, d ’ autant que par icelle il a luy seul le don de cognoistre et entendre les choses diuines. Amenant à ce propos ceste belle sentence de Ciceron, Itaque ex tot generibus animantium nullum est aliud praeter hominem, quod habeat notitiam aliquam Dei, Ex ipsisque hominibus nulla gens est, neque tam immansueta, neque tam fera, que non, etiam si ignoret qualem habere Deum deceat, habendum tamen sciat. Ex quo efficitur vt is aonoscat Deum, qui unde ortus sit, quasi recordetur. Doncques selon l ’ opinion de Lactance, la vraye marque de la différence de l ’ homme d ’ auec les autres animaux, c ’ est Sapience accompagnee de Religion. Consequemment en autres choses demourra vraye la diffinition d ’ Ulpian, qui fait le droict naturel comun à tous animaux, et ce qu ’ il a dit, Catera quoque animalia istius iuris peritia censeri. C ’ est à dire, que les animaux autres que l ’ homme, et mesmes les bestes sauuages sont prisez et estimez, pour la cognoissance qu ’ ils ont en eux de ce droict naturel. Combien que Laurens Valle au quatrieme liure de ses elegances, ait reprins ladite diffinition comme digne de moquerie : disant que le droict ne peut tomber aux bestes, et qu ’ on ne peut appeler droict, leur appetit et instinct naturel de se coupler ensemble, de courir sus l ’ vne à l ’ autre, et de s ’ entretuer. Mais ce n ’ est pas l ’ intention du Iurisconsulte, de dire que tout appetit naturel des bestes, non plus que des hommes, doyue estre appelé droict. Car ce seroit chose par trop absurde.","VANs entreprins de traiter du droict des Normas, à bonne cause nous auons commencé nostre oeuure par le tiltre de Droict etde Iustice, et par la diffinition de Droict sainsi qu ’ a fait l ’ Empereur Justinian en l ’ oeuure de ses Pandectes ou Digestesy, suyvant la doctrine de Ciceron, qui dit au commencement de ses Offices, Omnis que à ratione suscipitur de aliqua re disputatio, debet à diffinitione proficisci, vt intelligatur quid sit id de quo disputatur. Ce qui a esté suyui par ceeluy qui a recueilli et redigé par escrit nostre Coustume, quiconque fut-il. Lequel pourautant que ce mot de Droict a plusieurs significations, pourquoy ne le pouuoir bonnement diffinir en general, a iceluy expliqué par diuision. disant que l ’ vn est droict naturel, et l ’ autre est establi. Mais on pourroit de prime face blasmer ceste diuision, comme inparfaicte et moins que suffisante, et ne respondante à celle des anciens Conseillers de droict : lesquels ont diuisé le Droict en trois parties, cest à sçauoir en droict naturel, droict des gens, et droict ciuil : diffinissans le droict naturel en estre celuy que nature a enseigné à tous animaux, et n ’ appartenir pas tant seulement au gen
      re humain : le droict des gens estre celuy qui est gardé esgalement entre tous les hommes, appellé droict des gens, comme celuy dont usent toutes gens et nations humaines : et le droict ciuil estre celuy que chacun Peuple, ou chacune Cité, et Contree a establi pour soy, et pour son vtilité, ainsi appelé comme droict propre et particulier de chacune cité. a quoy ie respon pour sauuer ce blasme, quel ’ autheur ou conpilateur de nostre Coustume a comprins le droict des gens sous le droict naturel, comme descendant d ’ iceluy. Ce qu ’ il ne fait pas sans raison. Car les Conseillers de droict ont aussi appelé le droict des gens, droict naturel, comme celuy que la raisonnaturelle à establi entre tous les hommes. Et de faict on voit que ce que nostre texte attribue au droict naturel, est attribué au droict des gens par iceux Conseillers de droict, scilicet erga Deis reli gio : er parentibus obediamus, ac nefas esse homine homini insidiari. Lequel dernier poinct Ciceron a dit estre de droict naturel, au troisiesme de ses Offices, escriuant ainsi : Sihoc natura praeeribit, ot homo homini quicique sit, ob cam causam quod homo sit, consultù velitenecesse est secundi eam naturan, utilitate omnium effe communem. Quod siita est, una continétur omnes et eade lege nature. Idque ipsum si ita est, certeviolare alteris naturae lege prohibetur. Nous appelerons doncques le droict des gens, lus naturale secundarii. : et l ’ autre primariis aut primauum. Pour venir à la diffinition duquel, nous dirons par le texte de nostre Coustume, conformement à ce qu ’ en ont escrit les Philosophes et Theologiens, Que c ’ et proprement l ’ impression de la diuine lumière en la creature raisonnable, c ’ est à dire les intelligences et cognoissances engrauees en notre ame, qui nous induisent à suiure iustice, et fuir iniustice. Desquelles cognoissances comme de certains Principes dont le sens humain est preuenu et informé de nature, sans doctrine d ’ homme, nous tirons des conclusions, qui en procedent par bonne et necessaire conséquence, touchant les oeuures et actions requises et conuenables pour conseruer et entretenir la société, charité et coniunction humaine. De ce droict Ciceron a escrit ceste diuine sentence en son liure des loix. Sed comnium que in hominum doctorum disputatione versantur, nihil est profecto prestabilius, quam plane intelligi nos ad iustitiam esse natos : neque opinione, sed natura constitutum efse ius. Ce droict naturel est appelé Loy denature par iceluy Ciceron au lieu cy dessus extrait du troisiesme de ses Offices. a quoy s accorde ce qu ’ a escrit S. Paul au :. chap. de son epistre aux Romains, en cestemanière, cûm enim gentes que legem non habent, naturaliter ea que legis sunt, faciunt, he legem non habentes sibi ipsis sunt lex : qui ostendunt opus legis scriptum in cordibus suis. Ledit Ciceron l ’ appelle aussi Raison souvueraine, et Raison naturelle, disant audit liure des loix, Lex estratio summa insita à natura, que iubet ea que facienda sunt, prohibétque contraria. Outreplus il l ’ appelle Loy eternelle, escriuant ainsi : Hanc igitur video sapientisimorum fuisse sententiam, legem neque hominum inoeniis excogitatam, neque scitum aliquod esse popiilorum : sed xternum quiddam quod oniuersum mundum regeret, imperandi, prohibendique sapientia. Ita principem legem illam et oltimam, mentem esse dicebant omnia ratione. cogentis, aut vetantis Dei, ex qua illa lex quam dij humano generi dederune, recte laudata est, est enim ratio, mensque sapientis, ad iubenaum et ad deterrendum idonca. Il appelle doncques loy eternelle la raison commune infuse en la nature humaine, comme quelque part et portion de diuinité. a ce propos conuiët assez ce qu ’ a escrit Paul le Iurisconsulte, Quod ratio naturalis est tacita quedam lex. Et si on obiecte, qu ’ à ce que dessus s ’ accorde mal la diffinition du droict naturel, baillee par Ulpian, sçauoir ests Quod ius naturaleest quod natura omnia animalia docuit : d ’ autant que les bestes brutes ne sont capables ne participantes de raison : Nous respondrons qu ’ à la verité ce qu ’ auons cy dessus escrit, s ’ entend proprement du droict humain, et qui n ’ a lieu qu ’ entre les hommes : lequel est mieux exprimé par ce mot Droict, respondant au mot Latin. Rectum, que par ce mot Ius. Pource que par ce mot Droict, ne peut estre entendu, siné ce qui est bon, iuste et equitable, et reiglé par droite raison, ne déclinant à dextre n ’ a senestre. Mais en la diffinition dessusdite, lus naturale, signifie la vertu et puissance naturelle commune à tous animaux, qui les incline à la conseruation et defence de leur vie, à se conioindre ensemble à fin de generation, et auoir soin et souci de nourrir et essleuer leur geniture, pour perpetuer leurs especes. De ceste puissance naturelle a dit Pline parlant de la Tygre beste trescruelle entre les autres : laquelle par la premiere veué de l ’ homme, ou de ses pas est incitee à transporter ses faons, Nimirum hec naturae et rerum hec potentia cius, sauissimas ferarum maximasque que nunquam vidissent, quod debcant timere, statim intelligere cur sit timendum. Et combien qu ’ és animaux autres que les hommes, n ’ y ait parfaite raison, par laquelle ils puissent discourir, et tirer les conclusions qui s ’ ensuyuent des principes et causes de toutes choses, auoir memoire du passé, pourueoir et doner ordre aux choses presentes, et preueoir les futures, et auoir discretion du bien et du mal : toutesfois nous en voyons plusieurs, qui sont pourueus, et douez de gran de intelligence, et reluire en eux des exemples de vertu. Comme le formi, qui est creé auec telle prouidence naturelle, que Salomon n ’ a fait doute de renuoyer l ’ homme à ceste petite bestiole, pour apprendre sapience. La cigongne est apprinse de nature à nourrir pere et mere en leur vieillesse, leur rendant la pareille de ce qu ’ elle a receu d ’ eux en son enfance. La nature admirable et proprieté de mouches à miel, l ’ ingenieux artifice de leurs maisonnettes de cire, leurs polices, et l ’ obeissance qu ’ ils portent à leur Roy, a contraint Virgile d ’ escrire, esse apibus partè diuine mentis, et haustus Aethereos. Pline escrit de l ’ Elephant, le plus grand des animaux terrestres, qu ’ il approche fort du sens humain, entend la langue de son pays, y a en luy docilité, obeissance, mémoire du seruice qu ’ il doit, probité, prudence, equité, clemence, veneration du soleil et de la lune : de sorte qu ’ ainsi qu ’ il le paint, il semble ne luy manquer de ce qui appartient à l ’ homme, et que la parole, et la figure humaine. Veu lesquels exemples et autres infinis qu ’ on pourroit alléguer, ce n ’ est de merueille si Plutarque a escrit son petit traité, An brutis ratio insit. Mesme Lactance Philosophe Chrestien a osé affermer au troisiesme liure des diuines institutions, Que les choses qu ’ on estime estre propres et particulieres à l ’ homme, sont communes aussi aux autres animaux : et que raison leur a esté donee, autant seulement qu ’ il est requis pour la tuition et defence de leur vie. Mais à l ’ homme a esté donnée parfaite raison, appelée Sapiomce : qui rend l ’ homme singulier, et surpassant les autres animaux, d ’ autant que par icelle il a luy seul le don de cognoistre et entendre les choses diuines. Amenant à ce propos ceste belle sentence de Ciceron, Itaque ex tot generibus animantium nullum est aliud praeter hominem, quod habeat notitiam aliquam Dei, Ex ipsisque hominibus nulla gens est, neque tam immansueta, neque tam fera, que non, etiam si ignoret qualem habere Deum deceat, habendum tamen sciat. Ex quo efficitur vt is aonoscat Deum, qui unde ortus sit, quasi recordetur. Doncques selon l ’ opinion de Lactance, la vraye marque de la différence de l ’ homme d ’ auec les autres animaux, c ’ est Sapience accompagnee de Religion. Consequemment en autres choses demourra vraye la diffinition d ’ Ulpian, qui fait le droict naturel comun à tous animaux, et ce qu ’ il a dit, Catera quoque animalia istius iuris peritia censeri. C ’ est à dire, que les animaux autres que l ’ homme, et mesmes les bestes sauuages sont prisez et estimez, pour la cognoissance qu ’ ils ont en eux de ce droict naturel. Combien que Laurens Valle au quatrieme liure de ses elegances, ait reprins ladite diffinition comme digne de moquerie : disant que le droict ne peut tomber aux bestes, et qu ’ on ne peut appeler droict, leur appetit et instinct naturel de se coupler ensemble, de courir sus l ’ vne à l ’ autre, et de s ’ entretuer. Mais ce n ’ est pas l ’ intention du Iurisconsulte, de dire que tout appetit naturel des bestes, non plus que des hommes, doyue estre appelé droict. Car ce seroit chose par trop absurde.","LIVRE PREMIER QVI EST, DE LA IVSTICE ET DV droict des Normans.",De Droict et de Iustice. Chap. I.,La Coustume au premier chapitre.
