ID,Auteur,BnF,IdRef,Naissance (min),Naissance (max),Mort (min),Mort (max),N°,Témoin,Contexte G,Mention,Contexte D,Paragraphe,Partie,Chapitre,Section
justinien,Justinien Ier (0482-0565 ; empereur de Byzance),http://data.bnf.fr/ark:/12148/cb12055108q,http://www.idref.fr/027770591/id,0482,0482,0565,0565,63,basnage,"Cette incertitude et cette varieté de l ’ âge propre au mariage que le Droit Canonique a établie, fait bien connoître que la disposition du Droit Civil est beaucoup plus raisonnable ; car",Justinien,"voulant limiter un temps certain, a suivi ce qui arrive le plus souvent, à sçavoir que les hommes à quatorze ans, et les filles à douze, peuvent être capables des actes du mariage, bien que cela ne soit pas toûjours véritable, ou qu ’ au contraire il s ’ en trouve avant cet âge qui puissent engendrer","Cette incertitude et cette varieté de l ’ âge propre au mariage que le Droit Canonique a établie, fait bien connoître que la disposition du Droit Civil est beaucoup plus raisonnable ; car Justinien voulant limiter un temps certain, a suivi ce qui arrive le plus souvent, à sçavoir que les hommes à quatorze ans, et les filles à douze, peuvent être capables des actes du mariage, bien que cela ne soit pas toûjours véritable, ou qu ’ au contraire il s ’ en trouve avant cet âge qui puissent engendrer",coutume,DU DOUAIRE.,CCCLXIX. Femme quand a doüaire sur les biens du pere et ayeul de son mary.
justinien,Justinien Ier (0482-0565 ; empereur de Byzance),http://data.bnf.fr/ark:/12148/cb12055108q,http://www.idref.fr/027770591/id,0482,0482,0565,0565,64,basnage,"On demeure d ’ accord que Romulus fut l ’ Auteur de cette Loy qui défendoit aux veuves de se matier dans l ’ an de leur viduité ; il est vray que du temps de ce Prince l ’ année n ’ étoit Theodose que de dix mois lunaires. Les Empereurs Gratian, Valentinien, et Theodose I. ordonnerent que la défense de se marier dureroit pendant douze mois, l. 2. C. de Nuptiis ; mais comme cette Loy de Romulus n ’ imposoit aucune peine aux veuves qui la violoient, on les nota d ’ infamie par l ’ Edit du Preteur, et depuis les Empereurs y ajoûterent encore d ’ autres peines, et notamment elles furent privées de tous les bien-faits qu ’ elles avoient reçûs de leurs premiers tie maris.",Justinien,"leur ôta expressément Sbonsalitiam largitatem, ce que quelques-uns voulant ppliquer à nôtre doüaire, Mr Cujas a fait voir leur erreur, ayant marqué la difference par a définition de l ’ un et de l ’ autre, Observ. l. 5. c. 4. Les Papes Urbain. et Innocent III. changerent cette jurisprudence sur la fin du douzième siecle, c. penult. et ult. de 2. Nupt. aux Decret. de sorte que ce n ’ est plus une question parmy nous, qu ’ une veuve n ’ est point coupable de se remarier dans l ’ an du deüil pourvû qu ’ elle ne soit point enceinte : Les Loix Ro-maines qui punissent ces mariages precipitez n ’ ont plus d ’ autorité, elles ne sont observées que dans les Parlemens de Languedoc et de Provence, et le Droit Canonique a prevalu dans les autres, parce qu ’ il paroissoit fondé sur l ’ autorité de S. Paul, Chap. 3. Epist. Ad Corinth. uxor alligata est lege, quamdiu vivit vir ipsius ; quod si obdormierit libera est ut cui velit nubat tantùm in Domino. Duaren estimoit, comme le témoigne Mornac l. 11. de his qui notantur infamiâ, que les Canonistes avoient mal compris S. Paul, et donné une mauvaise explication à ses paroles.","On demeure d ’ accord que Romulus fut l ’ Auteur de cette Loy qui défendoit aux veuves de se matier dans l ’ an de leur viduité ; il est vray que du temps de ce Prince l ’ année n ’ étoit Theodose que de dix mois lunaires. Les Empereurs Gratian, Valentinien, et Theodose I. ordonnerent que la défense de se marier dureroit pendant douze mois, l. 2. C. de Nuptiis ; mais comme cette Loy de Romulus n ’ imposoit aucune peine aux veuves qui la violoient, on les nota d ’ infamie par l ’ Edit du Preteur, et depuis les Empereurs y ajoûterent encore d ’ autres peines, et notamment elles furent privées de tous les bien-faits qu ’ elles avoient reçûs de leurs premiers tie maris. Justinien leur ôta expressément Sbonsalitiam largitatem, ce que quelques-uns voulant ppliquer à nôtre doüaire, Mr Cujas a fait voir leur erreur, ayant marqué la difference par a définition de l ’ un et de l ’ autre, Observ. l. 5. c. 4. Les Papes Urbain. et Innocent III. changerent cette jurisprudence sur la fin du douzième siecle, c. penult. et ult. de 2. Nupt. aux Decret. de sorte que ce n ’ est plus une question parmy nous, qu ’ une veuve n ’ est point coupable de se remarier dans l ’ an du deüil pourvû qu ’ elle ne soit point enceinte : Les Loix Ro-maines qui punissent ces mariages precipitez n ’ ont plus d ’ autorité, elles ne sont observées que dans les Parlemens de Languedoc et de Provence, et le Droit Canonique a prevalu dans les autres, parce qu ’ il paroissoit fondé sur l ’ autorité de S. Paul, Chap. 3. Epist. Ad Corinth. uxor alligata est lege, quamdiu vivit vir ipsius ; quod si obdormierit libera est ut cui velit nubat tantùm in Domino. Duaren estimoit, comme le témoigne Mornac l. 11. de his qui notantur infamiâ, que les Canonistes avoient mal compris S. Paul, et donné une mauvaise explication à ses paroles.",coutume,DU DOUAIRE.,CCCLXXVII.
justinien,Justinien Ier (0482-0565 ; empereur de Byzance),http://data.bnf.fr/ark:/12148/cb12055108q,http://www.idref.fr/027770591/id,0482,0482,0565,0565,65,basnage,"On a crû qu ’ un an étoit le moins qu ’ une femme pouvoit donner à la mémoire de son mary, que c ’ étoit blesser la pudeur et la reverence qu ’ on doit au public, et faire un aveu d ’ une incontinence honteuse : qu ’ on ne devoit point opposer le Chapitre penultième et dernier, de fecundis Nuptiis, aux Decretales, parce que le Pape n ’ avoit pû abroger les peines établies par les Loix, que ce seroit passer les limites dans une chose où il n ’ est pas absolu ; en effet il ne la pas entrepris, et il est aisé de voir par ces deux Chapitres qu ’ il n ’ a ôté que l ’ infamie, infamia, disent-ils, aboletur, c ’ est le sentiment de M ’ Cujas sur la l. 1. au C. de secundis Nuptiisi et du Moulin sur le même Titre, appelle l ’ opinion contraire errorem Canonistarum. S. Paul a bien dit nubat, mais il ajoûte in Domino, il faut que le mariage se fasse dans les voyes legitimes. Jesus Christ n ’ a point de part à ces mariages qui se font contre l ’ honnêteté publi-que, et n ’ autorise point ce libertinage effrené. Bérault, sur l ’ Article 377. en rapporte un Arest ; l ’ Auteur de la Bibliotheque du Droit François en rapporte jusqu ’ à douze Arrests du Parlement de Tolofe qui autorisent cette jurisprudence ; et il y en a un de ce Parlement du 22. de Février 1666. au Rapport de Mr de Vigneral, posterieur à tous ceux-cy, par lequel on imposa cette peine aux femmes ingrates et sans pudeur, que même pendant la maladie de on mary elle ne l ’ avoit pas assisté, et qu ’ elle n ’ avoit fait venir des medecins que pour s ’ assuter par leur témoignage qu ’ il n ’ en échaperoit point ; que",Justinien,"en la Novelle 39. u Chapître 2. de restitutionibus, en apporte cette raison, ne qua prastiterit suspicionis maligna causa parce qu ’ un si grand empressement donne de justes soupçons d ’ une conduite criminelle du vivant du mary","On a crû qu ’ un an étoit le moins qu ’ une femme pouvoit donner à la mémoire de son mary, que c ’ étoit blesser la pudeur et la reverence qu ’ on doit au public, et faire un aveu d ’ une incontinence honteuse : qu ’ on ne devoit point opposer le Chapitre penultième et dernier, de fecundis Nuptiis, aux Decretales, parce que le Pape n ’ avoit pû abroger les peines établies par les Loix, que ce seroit passer les limites dans une chose où il n ’ est pas absolu ; en effet il ne la pas entrepris, et il est aisé de voir par ces deux Chapitres qu ’ il n ’ a ôté que l ’ infamie, infamia, disent-ils, aboletur, c ’ est le sentiment de M ’ Cujas sur la l. 1. au C. de secundis Nuptiisi et du Moulin sur le même Titre, appelle l ’ opinion contraire errorem Canonistarum. S. Paul a bien dit nubat, mais il ajoûte in Domino, il faut que le mariage se fasse dans les voyes legitimes. Jesus Christ n ’ a point de part à ces mariages qui se font contre l ’ honnêteté publi-que, et n ’ autorise point ce libertinage effrené. Bérault, sur l ’ Article 377. en rapporte un Arest ; l ’ Auteur de la Bibliotheque du Droit François en rapporte jusqu ’ à douze Arrests du Parlement de Tolofe qui autorisent cette jurisprudence ; et il y en a un de ce Parlement du 22. de Février 1666. au Rapport de Mr de Vigneral, posterieur à tous ceux-cy, par lequel on imposa cette peine aux femmes ingrates et sans pudeur, que même pendant la maladie de on mary elle ne l ’ avoit pas assisté, et qu ’ elle n ’ avoit fait venir des medecins que pour s ’ assuter par leur témoignage qu ’ il n ’ en échaperoit point ; que Justinien en la Novelle 39. u Chapître 2. de restitutionibus, en apporte cette raison, ne qua prastiterit suspicionis maligna causa parce qu ’ un si grand empressement donne de justes soupçons d ’ une conduite criminelle du vivant du mary",coutume,DU DOUAIRE.,CCCLXXVII.
justinien,Justinien Ier (0482-0565 ; empereur de Byzance),http://data.bnf.fr/ark:/12148/cb12055108q,http://www.idref.fr/027770591/id,0482,0482,0565,0565,66,basnage,"C. de Bon. Mater. ce droit des peres fut reduit au simple usufruit. Res que ex matris successione sive ex testamento, sive ab intestato fuerint ad filium devoluta, ita fint in parentum potestate, ut urendi, fruendi dumtaxat in diem vita facultatem, dominio videlicet earum ad liberos pertinente, quod & generaliter",Justinianus,"admisit in bonis omnibus adventitiis filio Nôtre Coûtume est différente en ces deux points : Le premier, que par la Loy quatrième du même Tître, le pere en se remariant ne perdoit point cet usufruit entier, et cet Article lesreduit au tiers. Le second, que cet usufruit appartenoit au pere en tous les biens adventifs du fils de famille en quelque temps qu ’ il leur éohussent, et cet Article n ’ accorde cet usufruit au mary que sur les biens que sa femme possedoit au temps de sa mort : ce droit est particulier aux Normans, l ’ on en trouve plusieurs Arrests dans lEchiquier, et cette longue antiquité est une marque de sa justice, car la meilleure preuve de l ’ équité d ’ une loy est qu ’ elle ait été observée inviolablement durant plusieurs siecles.","C. de Bon. Mater. ce droit des peres fut reduit au simple usufruit. Res que ex matris successione sive ex testamento, sive ab intestato fuerint ad filium devoluta, ita fint in parentum potestate, ut urendi, fruendi dumtaxat in diem vita facultatem, dominio videlicet earum ad liberos pertinente, quod & generaliter Justinianus admisit in bonis omnibus adventitiis filio Nôtre Coûtume est différente en ces deux points : Le premier, que par la Loy quatrième du même Tître, le pere en se remariant ne perdoit point cet usufruit entier, et cet Article lesreduit au tiers. Le second, que cet usufruit appartenoit au pere en tous les biens adventifs du fils de famille en quelque temps qu ’ il leur éohussent, et cet Article n ’ accorde cet usufruit au mary que sur les biens que sa femme possedoit au temps de sa mort : ce droit est particulier aux Normans, l ’ on en trouve plusieurs Arrests dans lEchiquier, et cette longue antiquité est une marque de sa justice, car la meilleure preuve de l ’ équité d ’ une loy est qu ’ elle ait été observée inviolablement durant plusieurs siecles.",coutume,DU DOUAIRE.,CCCLXXXII. Droit de viduitè appartenant au mary.
justinien,Justinien Ier (0482-0565 ; empereur de Byzance),http://data.bnf.fr/ark:/12148/cb12055108q,http://www.idref.fr/027770591/id,0482,0482,0565,0565,67,basnage,,Justinien,"ayant remarqué que cette quatrième portion qui étoit destinée pour les enfants n ’ étoit pas suffisante lors qu ’ ils étoient en grand nombre, estima qu ’ il étoit raisonnable de l ’ augmenter ; de sorte que quand le pere laissoit quatre enfans, ou au defsous, la legirime étoit le tiers ; et quand le nombre excedoit celuy de quatre, il lour appartenoit la moitlé de tout le bien de leur pere : Authent. de Triente et Semisso, S. 1.","Justinien ayant remarqué que cette quatrième portion qui étoit destinée pour les enfants n ’ étoit pas suffisante lors qu ’ ils étoient en grand nombre, estima qu ’ il étoit raisonnable de l ’ augmenter ; de sorte que quand le pere laissoit quatre enfans, ou au defsous, la legirime étoit le tiers ; et quand le nombre excedoit celuy de quatre, il lour appartenoit la moitlé de tout le bien de leur pere : Authent. de Triente et Semisso, S. 1.",coutume,DU DOUAIRE.,CCCXCIX. Doüaire propre aux enfans.
justinien,Justinien Ier (0482-0565 ; empereur de Byzance),http://data.bnf.fr/ark:/12148/cb12055108q,http://www.idref.fr/027770591/id,0482,0482,0565,0565,68,basnage,,Justinien,"par la Loy Hoc edicto l. C. eod. ayant interdit aux peres et aux meres qui contractoient de secondes nopces, de donner à leurs maris ou à leurs femmes une plus grande por-tion de leurs biens que celle de lun de leurs enfans, qui en auroit le moins, il reconnut à la fin que cette nécessité qu ’ il imposoit aux peres et aux meres les rendoit moins respectueux et obeissans, maxima ex hac constitutione iniquitas contra genitores efficiebatur, liberi etenim scientes quod aliquid omnino à genitoribus etiam nolentibus relinquendum est, omni licentia et lascivia suos genitores injuriis afficiebant. Cela le porta à y cherchen du remede, et pour cet effet il publia une autre Loy, par laquelle les enfans ingrats ne participoient point à ce benefice, sea quasi ingratos ab omni hujusmodi beneficio repelli. D. l. cum apertissimè. On peut dire de même, que quand un pere a sujet de prononcer une exhetedation, le fils ingtat est indigne du tiers Coûtumier, parce qu ’ il faut presumer que la Loy n ’ a point travaillé pour ceux qui ont violé la première et la plus sacrée des loix de la nature : en tous cas, en faisant passer ce benefice aux enfans de l ’ exheredé, il seroit juste de le reduire aux simples alimens Le tiers Coûtumier étant une grace que la Coûtume accorde aux enfans, elle est purement personnelle, et n ’ est point transmissible à des heritiers collateraux ; et pour empescher cette transmission l ’ on se sert de cette raison, qu ’ il n ’ est pas acquis de plein droit aux enfans, an contraire pour l ’ obtenir la Coûtume leur impose la nécessité de renoncer ; et nuoy que l ’ on ne puisse plus douter de cette maxime aprés lArrest rapporté par Berault sur l ’ Art. CCCCIII eanmoins la question en fut encore agitée en l ’ Audience de la GrandeChambre, le 17. du UJuillet 1653. François Pienouvel avoit laissé une fille mineure, à laquelle Pierre Lestiboudois fut institué tuteur par l ’ avis des parens ; ce tuteur accepta la succession du pere, faus à cette mineure à renoncer aprés sa majorité : Elle déceda peu de temps aprés avoir atteint l ’ âge de vingt ans : Robert Lestiboudois s ’ en porta heritier, et en cette qualité declara renoncer à la succession de François Pienouvel ; et en consequente ayant demandé le tiers Coûtumier qui auroit appartenu à cette fille, André le Peley, creancier de Pienouvel, soûtint que ce droit d ’ option n ’ étoit point rransmissible aux heritiers collateraux, et que d ’ ailleurs la mineure ayant accepté la succession, et ne l ’ ayant point repudiée aprés sa majorité, il ne pouvoit pretendn de tiers Coûtumier à son droit, que par la Novelle 91. de Duar. dot. debit. l ’ enfant a bien le même privilege que sa mere pour repeter sa dot quand il en est heritier, mais un autre heritier n ’ a pas ce privilege : Le Vicomte avoit jugé la question en faveur du creancier, et de-Claré l ’ heritier sujet aux dettes ; le Bailly l ’ avoit cassée : Par l ’ Arrest les Sentences du Vicomte et du Bailly furent cassées, et en reformant, Lestiboudois fut déclaré non recevable à sa demande, sauf à luy à se porter heritier par benefice d ’ inventaire, plaidans Nallot et Vallognes.","Justinien par la Loy Hoc edicto l. C. eod. ayant interdit aux peres et aux meres qui contractoient de secondes nopces, de donner à leurs maris ou à leurs femmes une plus grande por-tion de leurs biens que celle de lun de leurs enfans, qui en auroit le moins, il reconnut à la fin que cette nécessité qu ’ il imposoit aux peres et aux meres les rendoit moins respectueux et obeissans, maxima ex hac constitutione iniquitas contra genitores efficiebatur, liberi etenim scientes quod aliquid omnino à genitoribus etiam nolentibus relinquendum est, omni licentia et lascivia suos genitores injuriis afficiebant. Cela le porta à y cherchen du remede, et pour cet effet il publia une autre Loy, par laquelle les enfans ingrats ne participoient point à ce benefice, sea quasi ingratos ab omni hujusmodi beneficio repelli. D. l. cum apertissimè. On peut dire de même, que quand un pere a sujet de prononcer une exhetedation, le fils ingtat est indigne du tiers Coûtumier, parce qu ’ il faut presumer que la Loy n ’ a point travaillé pour ceux qui ont violé la première et la plus sacrée des loix de la nature : en tous cas, en faisant passer ce benefice aux enfans de l ’ exheredé, il seroit juste de le reduire aux simples alimens Le tiers Coûtumier étant une grace que la Coûtume accorde aux enfans, elle est purement personnelle, et n ’ est point transmissible à des heritiers collateraux ; et pour empescher cette transmission l ’ on se sert de cette raison, qu ’ il n ’ est pas acquis de plein droit aux enfans, an contraire pour l ’ obtenir la Coûtume leur impose la nécessité de renoncer ; et nuoy que l ’ on ne puisse plus douter de cette maxime aprés lArrest rapporté par Berault sur l ’ Art. CCCCIII eanmoins la question en fut encore agitée en l ’ Audience de la GrandeChambre, le 17. du UJuillet 1653. François Pienouvel avoit laissé une fille mineure, à laquelle Pierre Lestiboudois fut institué tuteur par l ’ avis des parens ; ce tuteur accepta la succession du pere, faus à cette mineure à renoncer aprés sa majorité : Elle déceda peu de temps aprés avoir atteint l ’ âge de vingt ans : Robert Lestiboudois s ’ en porta heritier, et en cette qualité declara renoncer à la succession de François Pienouvel ; et en consequente ayant demandé le tiers Coûtumier qui auroit appartenu à cette fille, André le Peley, creancier de Pienouvel, soûtint que ce droit d ’ option n ’ étoit point rransmissible aux heritiers collateraux, et que d ’ ailleurs la mineure ayant accepté la succession, et ne l ’ ayant point repudiée aprés sa majorité, il ne pouvoit pretendn de tiers Coûtumier à son droit, que par la Novelle 91. de Duar. dot. debit. l ’ enfant a bien le même privilege que sa mere pour repeter sa dot quand il en est heritier, mais un autre heritier n ’ a pas ce privilege : Le Vicomte avoit jugé la question en faveur du creancier, et de-Claré l ’ heritier sujet aux dettes ; le Bailly l ’ avoit cassée : Par l ’ Arrest les Sentences du Vicomte et du Bailly furent cassées, et en reformant, Lestiboudois fut déclaré non recevable à sa demande, sauf à luy à se porter heritier par benefice d ’ inventaire, plaidans Nallot et Vallognes.",coutume,DU DOUAIRE.,CCCXCIX. Doüaire propre aux enfans.
justinien,Justinien Ier (0482-0565 ; empereur de Byzance),http://data.bnf.fr/ark:/12148/cb12055108q,http://www.idref.fr/027770591/id,0482,0482,0565,0565,69,basnage,"En cet Article la Coûtume donne une legitime, ou comme on parle ailleurs, un doüaire propre aux enfans sur les biens de leur mere : Cette seule disposition la pourra rendre digne de ce glorieux éloge de sage Coûtume, qui luy est attribué par plusieurs Auteurs ; car l ’ on peut dire véritablement que par cette disposition elle a surpassé la sagesse des Loix Romaines, et des Coûtumes de France, en ce qu ’ elle n ’ asseure pas seulement la subsistance des enfans sur les biens du pere, mais aussi sur ceux de la mere. Par l ’ ancien Droit Romain les enfans avoient une legitime sur les biens du pere ; mais la mere ny l ’ ayeul matemel n ’ étoient point obligez d ’ instituer heritiers leurs enfans, ou petits enfans : Mater vel abus necesse non habent li-beros suos aut beredes instituere, aut exheredare, sed possunt eos silentio omittere. On permettoit toutefois aux enfans d ’ accuser leur testament comme inofficieux, et le S. Mater fut depuis corrigé par une Novelle de",Justinien,,"En cet Article la Coûtume donne une legitime, ou comme on parle ailleurs, un doüaire propre aux enfans sur les biens de leur mere : Cette seule disposition la pourra rendre digne de ce glorieux éloge de sage Coûtume, qui luy est attribué par plusieurs Auteurs ; car l ’ on peut dire véritablement que par cette disposition elle a surpassé la sagesse des Loix Romaines, et des Coûtumes de France, en ce qu ’ elle n ’ asseure pas seulement la subsistance des enfans sur les biens du pere, mais aussi sur ceux de la mere. Par l ’ ancien Droit Romain les enfans avoient une legitime sur les biens du pere ; mais la mere ny l ’ ayeul matemel n ’ étoient point obligez d ’ instituer heritiers leurs enfans, ou petits enfans : Mater vel abus necesse non habent li-beros suos aut beredes instituere, aut exheredare, sed possunt eos silentio omittere. On permettoit toutefois aux enfans d ’ accuser leur testament comme inofficieux, et le S. Mater fut depuis corrigé par une Novelle de Justinien",coutume,DU DOUAIRE.,CCCCIV. Tiers des biens appartenant à la femme acquis aux enfans.
justinien,Justinien Ier (0482-0565 ; empereur de Byzance),http://data.bnf.fr/ark:/12148/cb12055108q,http://www.idref.fr/027770591/id,0482,0482,0565,0565,70,basnage,,Justinien,"l ’ a réglé de la sorte par la Novelle 22. c. 28. De Nupt. optimum visum est mortis e binubi parentis observari tempus ; c ’ est la jurisprudence du Parlement de Paris. Ricard, sur l ’ Article 279. de la Coûtume de Paris. Loüet, l. N. n. 2. De la Lande, Article 203. de la Coû-tume d ’ Orléans. Cujas, Consult. 33. l ’ Auteur des Institutes du Droit François, l. 1. 1. de Nupt.","Justinien l ’ a réglé de la sorte par la Novelle 22. c. 28. De Nupt. optimum visum est mortis e binubi parentis observari tempus ; c ’ est la jurisprudence du Parlement de Paris. Ricard, sur l ’ Article 279. de la Coûtume de Paris. Loüet, l. N. n. 2. De la Lande, Article 203. de la Coû-tume d ’ Orléans. Cujas, Consult. 33. l ’ Auteur des Institutes du Droit François, l. 1. 1. de Nupt.",coutume,DU DOUAIRE.,CCCCV. Femme que peut donner à son second mary.
justinien,Justinien Ier (0482-0565 ; empereur de Byzance),http://data.bnf.fr/ark:/12148/cb12055108q,http://www.idref.fr/027770591/id,0482,0482,0565,0565,71,basnage,"Il est vray que cet Empire étant devenu en quelque sorte Grec par la translation du Siege de lEmpire de Rome à Constantinople, et la langue Grecque étant aussi presque devenue la langue de l ’ Etat,",Justinien,"approuva que les institutions d ’ heritier pûssent être faites en Greci mais outre que lon favorisoit extraordinairement la liberté de tester, on peut dire qu ’ en ce temps-là les Romains avoient beaucoup perdu de leur ancienne generosité. Les anciens Romains quoy qu ’ ils connussent fort bien la delicatesse et les graces de la langue Grecque, l ’ en permirent point neanmoins l ’ usage public, nulla non in re pallium toge subfici non arbitrabantur indignum esse, existimantes illecebris, & suavitate linguarum imperii pondus et autori-tatem domari, Valer. Max. ibid.","Il est vray que cet Empire étant devenu en quelque sorte Grec par la translation du Siege de lEmpire de Rome à Constantinople, et la langue Grecque étant aussi presque devenue la langue de l ’ Etat, Justinien approuva que les institutions d ’ heritier pûssent être faites en Greci mais outre que lon favorisoit extraordinairement la liberté de tester, on peut dire qu ’ en ce temps-là les Romains avoient beaucoup perdu de leur ancienne generosité. Les anciens Romains quoy qu ’ ils connussent fort bien la delicatesse et les graces de la langue Grecque, l ’ en permirent point neanmoins l ’ usage public, nulla non in re pallium toge subfici non arbitrabantur indignum esse, existimantes illecebris, & suavitate linguarum imperii pondus et autori-tatem domari, Valer. Max. ibid.",coutume,DES TESTAMENS.,CCCCXII. Forme et solennité de Testament.
