ID,Auteur,BnF,IdRef,Naissance (min),Naissance (max),Mort (min),Mort (max),N°,Témoin,Contexte G,Mention,Contexte D,Paragraphe,Partie,Chapitre,Section
justinien,Justinien Ier (0482-0565 ; empereur de Byzance),http://data.bnf.fr/ark:/12148/cb12055108q,http://www.idref.fr/027770591/id,0482,0482,0565,0565,11,berault,"La plus part des art. de ce tit. sont tirez d ’ un art. donné le 2 8. Mars 1538. les chambres assemblées entre Marie de Cerisey dame de Fauguernon et Artur de Manneuille lequel art. est au registre secret. Et cette Coust. entant qu ’ elle defend aux maris l ’ alienation du bien de leurs femmes, est fondée sur le droit Romain, ou se trouuent trois loix establies par les Empereurs pour la conseruation des biens dotaux des femmes. La première a esté la loy Iulia, qui estoit d ’ Auguste l. 4. ff. de fun. do. La seconde d ’ Anastase l. 20. iubemus C. ad S. C. vellei. La derniere de",Justinian,"in l. 2n. 8. et cum lex Iulia C. de rei ux. act. par laquelle il defendit de vendre ou engager le bien de la femme soit de son consentement ou contresa volonté, ne, inquit, fragilitate naturae suc in repentinam deducatur inopiam. En quoyce droit Romain est different du nostre qui permet l ’ alienation faite par le mary du consentement de sa femme, et celle qui est faite par elle de l ’ autorité et consentement de son mary, ou bien il faut que l ’ un et l ’ autre vendent par ensembles et ne peuuent valablement contracter l ’ un sans l ’ autre : ou si le mary contracte il faut qu ’ il ait d ’ elle procuration : de laquelle il doit monstrer l ’ original poury adiouster foy, et ne suffiroit pas de la dater, nu en inserer la copie dans le cont trat de vendition quand il est passé par deuant autres tabellions que ceux qui ont passé ladite procuration. Mais si le contrat de venduë est passé par deuant les mesmes tabellions qui ont passé la procuration, il suffit que la copie soit inscritte et insèrée dans l ’ instrument de ladite venduë pour faire plaine foyde ladite procuration comme dit du Moulin sur les fiefs S. 5. nu. 44. Pareillement quand il est question d ’ autre cas heredital qui concerne la femme le mary ne peut pas feul et en sonnom agir ou defendre, ains faut qu ’ il ait d ’ elle procuration, comme dit du Moulin sur les fiefs S. 14. nu. 24. et ainsi a esté iugé par arrest du 1a. Mars 1537. entre le sieur de Boisyuon et le sieur de Prestreual et par plusieurs autres arrests subsecutifs. Ratio quia ci cui alienatio interdicitur actiones exercere non permittitur l. ait pratorS quid sit ff. de iure delib. maritus autem solus res uxoris non potest alienare quia non est dominus rerum dotalium, sed vere et naturaliter mulier remanet domina l. in rebus C. de ii. dot. Molin. S. 25. nu. 1. et 2. Mais pour le regard des actions mobiliaires et possessoires le mary les peut intenter et deduire en iugement sans sa femme, dautant qu ’ ilest seigneur des biens meubles dicelle et fait les fruits siens des biens dotaux.","La plus part des art. de ce tit. sont tirez d ’ un art. donné le 2 8. Mars 1538. les chambres assemblées entre Marie de Cerisey dame de Fauguernon et Artur de Manneuille lequel art. est au registre secret. Et cette Coust. entant qu ’ elle defend aux maris l ’ alienation du bien de leurs femmes, est fondée sur le droit Romain, ou se trouuent trois loix establies par les Empereurs pour la conseruation des biens dotaux des femmes. La première a esté la loy Iulia, qui estoit d ’ Auguste l. 4. ff. de fun. do. La seconde d ’ Anastase l. 20. iubemus C. ad S. C. vellei. La derniere de Justinian in l. 2n. 8. et cum lex Iulia C. de rei ux. act. par laquelle il defendit de vendre ou engager le bien de la femme soit de son consentement ou contresa volonté, ne, inquit, fragilitate naturae suc in repentinam deducatur inopiam. En quoyce droit Romain est different du nostre qui permet l ’ alienation faite par le mary du consentement de sa femme, et celle qui est faite par elle de l ’ autorité et consentement de son mary, ou bien il faut que l ’ un et l ’ autre vendent par ensembles et ne peuuent valablement contracter l ’ un sans l ’ autre : ou si le mary contracte il faut qu ’ il ait d ’ elle procuration : de laquelle il doit monstrer l ’ original poury adiouster foy, et ne suffiroit pas de la dater, nu en inserer la copie dans le cont trat de vendition quand il est passé par deuant autres tabellions que ceux qui ont passé ladite procuration. Mais si le contrat de venduë est passé par deuant les mesmes tabellions qui ont passé la procuration, il suffit que la copie soit inscritte et insèrée dans l ’ instrument de ladite venduë pour faire plaine foyde ladite procuration comme dit du Moulin sur les fiefs S. 5. nu. 44. Pareillement quand il est question d ’ autre cas heredital qui concerne la femme le mary ne peut pas feul et en sonnom agir ou defendre, ains faut qu ’ il ait d ’ elle procuration, comme dit du Moulin sur les fiefs S. 14. nu. 24. et ainsi a esté iugé par arrest du 1a. Mars 1537. entre le sieur de Boisyuon et le sieur de Prestreual et par plusieurs autres arrests subsecutifs. Ratio quia ci cui alienatio interdicitur actiones exercere non permittitur l. ait pratorS quid sit ff. de iure delib. maritus autem solus res uxoris non potest alienare quia non est dominus rerum dotalium, sed vere et naturaliter mulier remanet domina l. in rebus C. de ii. dot. Molin. S. 25. nu. 1. et 2. Mais pour le regard des actions mobiliaires et possessoires le mary les peut intenter et deduire en iugement sans sa femme, dautant qu ’ ilest seigneur des biens meubles dicelle et fait les fruits siens des biens dotaux.","COMMENTAIRES SVR LES COVSTVMES DV PAYS DE NORMANDIE, ANCIENS RESSORS ET ENCLAVES D ICELVY.",DE BRIEF DE MARIAGE ENCOMBRÉ.,V. C. XXXVIII.
justinien,Justinien Ier (0482-0565 ; empereur de Byzance),http://data.bnf.fr/ark:/12148/cb12055108q,http://www.idref.fr/027770591/id,0482,0482,0565,0565,12,berault,"’ EXECVTION par decret est vn autre moyend ’ acquerir. Varro lib. 2. de re rustica inter modos dominiumacquirendi auctionem enumierat, auctio ab augendo dicta, quia ei qui plurimum auget res addicitur. Iure Romano deficiétibus licitatori us debitores ius dominilimpetrabant, quod quomodu fiebat disserit Brissonius 4. select. cap. 9. Au lieu dequoy nous vions des decrets, lesquels pour estre faits de choses immeubles sont estiniez de grande importance, Car comme dit Ciceron enl ’ oraison pro Quintio, De quo homine vox predicat et precium conficit, huic acerbissimum Ciuo videntique funus ducitur, si funus id habendum sit quo non amici conueniunt ad exequias cohonestandas, sed bonorumemptores vt carnifices ad relliquias vita lacerandas et distrabendas. Itaque maiores nostriraro id accidere voluerunt, pratores ait conside. rate fièret comparauerunt : considerant enim quid et quantum sit alterius bona proseribere : is enim cuius bona sub pracone enierunt non modo ex numero viuorum exiinbatur, sed et si fieri potest infra etiam mortuos mandatur. C ’ est pourquoyon aordonné pour les decrets plusieurs formes et solemnitez, l ’ omission desquelles fait annuller le decret et le rend suiet à cassation l. 1. de fide instrum. et in. histi fisc. lib. 10. C. et Cujac. in d. l. Ce qui a lieu pareillement en autres cas ou sont prescrites par la loy ou ordonnances certaines formes l. statutis C. de sententa ex breuic, recit. Rebuff. in forma mand. apost. in princ. in concordatis. Les formes des decrets ont esté prescrites par les ordonnances : mais il faut plust ost suiuir ce qui a esté arresté par la Coustume en cette prouince, ayans esté les articles redigez par permission du Roy, qui les a approuuez et homologuez, et par la tacitement derogé à auc unes ordonnances, comme apparoist parla reformation generale de la Coustu. dont on aré digé tant d ’ articles qu ’ il sembloit que la voye des decrets fust tellement vnie et applanie qu ’ on n ’ y peust plustrouuer de formais aucun serupule ou difficulté. Et neanmoins on n ’ y auoit amplement fatisfait, et comme dit",l ’ Empereur Justinian,"en l ’ auth. quib. mod. nat. effic. les, recté dictum est à predecessoribus nostris et ante omnes à Iuliano sapientisimo, quia nulla lex neque senatus, onsultum prolatum in republica Rom. videtur ad omnia sussicienter abinitio promulgatum, sedmulta indigere correctione ot adnaturae varietatem et eius machinationes sufficiat. C ’ est pourquoy dix-sept ans apres à sçauoir en l ’ an 6o0. on a trouué nécessaire faire vne autre reformationisur les decrets pour l ’ abreuiation d ’ iceux, et pourreleuer les parties des grands frais qui consommoyent le plus souüent la plus grande partie du prix. Et vouloit-on encor proceder à la reformation de plusieurs autres articles de la Coustume. Ce qui n ’ a esté encor fait, et differe-on peut estre en consideration qu ’ il n ’ est pas expedient de changer ne innouer aucune chose en vne loy ou Coustume : car le changement frequent diminué du re spect et autorité des loix, lesquelles sont venerables presque autant par leur antiquité que par leur vtilité. Et comme dit Aristote au à, liure de ses politiques chapitre 6. la loy n ’ a aucune force pour se faire obeir que la coustume qui n ’ est cofirmée que par longueur du tems : et le changement des loix presentes en autres nouuelles rendimbecille la vertu de la loy.","’ EXECVTION par decret est vn autre moyend ’ acquerir. Varro lib. 2. de re rustica inter modos dominiumacquirendi auctionem enumierat, auctio ab augendo dicta, quia ei qui plurimum auget res addicitur. Iure Romano deficiétibus licitatori us debitores ius dominilimpetrabant, quod quomodu fiebat disserit Brissonius 4. select. cap. 9. Au lieu dequoy nous vions des decrets, lesquels pour estre faits de choses immeubles sont estiniez de grande importance, Car comme dit Ciceron enl ’ oraison pro Quintio, De quo homine vox predicat et precium conficit, huic acerbissimum Ciuo videntique funus ducitur, si funus id habendum sit quo non amici conueniunt ad exequias cohonestandas, sed bonorumemptores vt carnifices ad relliquias vita lacerandas et distrabendas. Itaque maiores nostriraro id accidere voluerunt, pratores ait conside. rate fièret comparauerunt : considerant enim quid et quantum sit alterius bona proseribere : is enim cuius bona sub pracone enierunt non modo ex numero viuorum exiinbatur, sed et si fieri potest infra etiam mortuos mandatur. C ’ est pourquoyon aordonné pour les decrets plusieurs formes et solemnitez, l ’ omission desquelles fait annuller le decret et le rend suiet à cassation l. 1. de fide instrum. et in. histi fisc. lib. 10. C. et Cujac. in d. l. Ce qui a lieu pareillement en autres cas ou sont prescrites par la loy ou ordonnances certaines formes l. statutis C. de sententa ex breuic, recit. Rebuff. in forma mand. apost. in princ. in concordatis. Les formes des decrets ont esté prescrites par les ordonnances : mais il faut plust ost suiuir ce qui a esté arresté par la Coustume en cette prouince, ayans esté les articles redigez par permission du Roy, qui les a approuuez et homologuez, et par la tacitement derogé à auc unes ordonnances, comme apparoist parla reformation generale de la Coustu. dont on aré digé tant d ’ articles qu ’ il sembloit que la voye des decrets fust tellement vnie et applanie qu ’ on n ’ y peust plustrouuer de formais aucun serupule ou difficulté. Et neanmoins on n ’ y auoit amplement fatisfait, et comme dit l ’ Empereur Justinian en l ’ auth. quib. mod. nat. effic. les, recté dictum est à predecessoribus nostris et ante omnes à Iuliano sapientisimo, quia nulla lex neque senatus, onsultum prolatum in republica Rom. videtur ad omnia sussicienter abinitio promulgatum, sedmulta indigere correctione ot adnaturae varietatem et eius machinationes sufficiat. C ’ est pourquoy dix-sept ans apres à sçauoir en l ’ an 6o0. on a trouué nécessaire faire vne autre reformationisur les decrets pour l ’ abreuiation d ’ iceux, et pourreleuer les parties des grands frais qui consommoyent le plus souüent la plus grande partie du prix. Et vouloit-on encor proceder à la reformation de plusieurs autres articles de la Coustume. Ce qui n ’ a esté encor fait, et differe-on peut estre en consideration qu ’ il n ’ est pas expedient de changer ne innouer aucune chose en vne loy ou Coustume : car le changement frequent diminué du re spect et autorité des loix, lesquelles sont venerables presque autant par leur antiquité que par leur vtilité. Et comme dit Aristote au à, liure de ses politiques chapitre 6. la loy n ’ a aucune force pour se faire obeir que la coustume qui n ’ est cofirmée que par longueur du tems : et le changement des loix presentes en autres nouuelles rendimbecille la vertu de la loy.","COMMENTAIRES SVR LES COVSTVMES DV PAYS DE NORMANDIE, ANCIENS RESSORS ET ENCLAVES D ICELVY.",DES EXECVTIONS PAR DECRET.,introduction
justinien,Justinien Ier (0482-0565 ; empereur de Byzance),http://data.bnf.fr/ark:/12148/cb12055108q,http://www.idref.fr/027770591/id,0482,0482,0565,0565,1,merville,"Cet Article explique trois formalitez pour pouvoir se dire & porter heritier par benefice d ’ inventaire, dont l ’ établissement est dû au Droit Romain, c ’ est",Empereur Justinien,"qui l ’ a introduit par la Loy dernière au Cod. de jure deliberandi, pour empécher la confusion des biens & droits personnels de l ’ heritier par benefice d ’ inventaire d ’ avec les biens & droits de la succession, & que l ’ heritier beneficiaire ne soit tenu envers les créanciers de la succession, altra vires & effets des biens de la succession, ni tenu personnellement des dettes de la succession sur ses propres biens.","Cet Article explique trois formalitez pour pouvoir se dire & porter heritier par benefice d ’ inventaire, dont l ’ établissement est dû au Droit Romain, c ’ est Empereur Justinien qui l ’ a introduit par la Loy dernière au Cod. de jure deliberandi, pour empécher la confusion des biens & droits personnels de l ’ heritier par benefice d ’ inventaire d ’ avec les biens & droits de la succession, & que l ’ heritier beneficiaire ne soit tenu envers les créanciers de la succession, altra vires & effets des biens de la succession, ni tenu personnellement des dettes de la succession sur ses propres biens.",DECISIONS SUR CHAQUE ARTICLE DE LA COUTUME DE NORMANDIE.,TITRE HUITIEME. DU BENEFICE D ’ INVENTAIRE.,ARTICLE LXXXVI.
justinien,Justinien Ier (0482-0565 ; empereur de Byzance),http://data.bnf.fr/ark:/12148/cb12055108q,http://www.idref.fr/027770591/id,0482,0482,0565,0565,1,pesnelle,"LE. Droit de Patronage d ’ Eglise a été accordé en reconnoissance des bienfaits faits à l ’ Eglise, soit qu ’ on lui ait donné le fonds sur lequel le Temple aiété, pati, soit qu ’ on ait fourni les frais de la construction du Temple, ioit enfin qu ’ on l ’ ait doté en lui aumonant un revonu pour le faire desservir : Palro-num faciunt dos, aedificato, fundis. Ce Droit paroit établi dans les Novelles de",Justinien,"57, au chap. 2, & dans ant23., au chap. 18. Il étoit dans son egmmencement personnel, Justinien l ’ étendit aux enfans des Fienfaiteurs ; mass depuis il est devenu patrimonial & successif, comme dépendant du fonds ou Fief, auquel il est répute annexé. C ’ est par cette raison qu ’ il peut être algné par venteveéchanpe ou donation ; & il n ’ est pas nécessaire que ces aliénations se fassent avec Paliénation de l ’ université du Fief, il suffit qu ’ elles soient faite ; avec : quelqué dépendance d ’ icelui, comme quelque partie de la rente Seigncunale, à laquelle on voudra annexor le Patronage. De plus, quand le Patro-nagerest : alternatif, un des Patrons peut disposer de la portion qu ’ il a au Patronagé, en faveur de l ’ autre Patron, sans &. joindre aucune partie où dépen-dance de son Fief, parce que cette difposition réunissant le Patronane qui avoit été divisé, le rejoint au fonds de celui au bénéfice duquel il accroit : ce qui éts-jugé par un Arrêt du 2a. Lévrier 163t. En outre, les Patrons peuvent donner-& aumoner à l ’ Eglise leur droit de présenter aux Hénéfices, sans y joindre auoun fonds ou dépondance d ’ un Fief, comme il g ’ induit de l ’ Article CXl. Il qui réserve au donateur, à ses héritiers ou ayans cause au Fief ou Glebe ausquels droit annexé le Patronage, tous ses droits, honoraires dus aux Patrons.","LE. Droit de Patronage d ’ Eglise a été accordé en reconnoissance des bienfaits faits à l ’ Eglise, soit qu ’ on lui ait donné le fonds sur lequel le Temple aiété, pati, soit qu ’ on ait fourni les frais de la construction du Temple, ioit enfin qu ’ on l ’ ait doté en lui aumonant un revonu pour le faire desservir : Palro-num faciunt dos, aedificato, fundis. Ce Droit paroit établi dans les Novelles de Justinien 57, au chap. 2, & dans ant23., au chap. 18. Il étoit dans son egmmencement personnel, Justinien l ’ étendit aux enfans des Fienfaiteurs ; mass depuis il est devenu patrimonial & successif, comme dépendant du fonds ou Fief, auquel il est répute annexé. C ’ est par cette raison qu ’ il peut être algné par venteveéchanpe ou donation ; & il n ’ est pas nécessaire que ces aliénations se fassent avec Paliénation de l ’ université du Fief, il suffit qu ’ elles soient faite ; avec : quelqué dépendance d ’ icelui, comme quelque partie de la rente Seigncunale, à laquelle on voudra annexor le Patronage. De plus, quand le Patro-nagerest : alternatif, un des Patrons peut disposer de la portion qu ’ il a au Patronagé, en faveur de l ’ autre Patron, sans &. joindre aucune partie où dépen-dance de son Fief, parce que cette difposition réunissant le Patronane qui avoit été divisé, le rejoint au fonds de celui au bénéfice duquel il accroit : ce qui éts-jugé par un Arrêt du 2a. Lévrier 163t. En outre, les Patrons peuvent donner-& aumoner à l ’ Eglise leur droit de présenter aux Hénéfices, sans y joindre auoun fonds ou dépondance d ’ un Fief, comme il g ’ induit de l ’ Article CXl. Il qui réserve au donateur, à ses héritiers ou ayans cause au Fief ou Glebe ausquels droit annexé le Patronage, tous ses droits, honoraires dus aux Patrons.",COUTUME DE NORMANDIE.,CHAPITRE CINQUIEME. DE PATRONAGE D ’ ÉGLISE.,introduction
justinien,Justinien Ier (0482-0565 ; empereur de Byzance),http://data.bnf.fr/ark:/12148/cb12055108q,http://www.idref.fr/027770591/id,0482,0482,0565,0565,2,pesnelle,"LE. Droit de Patronage d ’ Eglise a été accordé en reconnoissance des bienfaits faits à l ’ Eglise, soit qu ’ on lui ait donné le fonds sur lequel le Temple aiété, pati, soit qu ’ on ait fourni les frais de la construction du Temple, ioit enfin qu ’ on l ’ ait doté en lui aumonant un revonu pour le faire desservir : Palro-num faciunt dos, aedificato, fundis. Ce Droit paroit établi dans les Novelles de Justinien 57, au chap. 2, & dans ant23., au chap. 18. Il étoit dans son egmmencement personnel,",Justinien,"l ’ étendit aux enfans des Fienfaiteurs ; mass depuis il est devenu patrimonial & successif, comme dépendant du fonds ou Fief, auquel il est répute annexé. C ’ est par cette raison qu ’ il peut être algné par venteveéchanpe ou donation ; & il n ’ est pas nécessaire que ces aliénations se fassent avec Paliénation de l ’ université du Fief, il suffit qu ’ elles soient faite ; avec : quelqué dépendance d ’ icelui, comme quelque partie de la rente Seigncunale, à laquelle on voudra annexor le Patronage. De plus, quand le Patro-nagerest : alternatif, un des Patrons peut disposer de la portion qu ’ il a au Patronagé, en faveur de l ’ autre Patron, sans &. joindre aucune partie où dépen-dance de son Fief, parce que cette difposition réunissant le Patronane qui avoit été divisé, le rejoint au fonds de celui au bénéfice duquel il accroit : ce qui éts-jugé par un Arrêt du 2a. Lévrier 163t. En outre, les Patrons peuvent donner-& aumoner à l ’ Eglise leur droit de présenter aux Hénéfices, sans y joindre auoun fonds ou dépondance d ’ un Fief, comme il g ’ induit de l ’ Article CXl. Il qui réserve au donateur, à ses héritiers ou ayans cause au Fief ou Glebe ausquels droit annexé le Patronage, tous ses droits, honoraires dus aux Patrons.","LE. Droit de Patronage d ’ Eglise a été accordé en reconnoissance des bienfaits faits à l ’ Eglise, soit qu ’ on lui ait donné le fonds sur lequel le Temple aiété, pati, soit qu ’ on ait fourni les frais de la construction du Temple, ioit enfin qu ’ on l ’ ait doté en lui aumonant un revonu pour le faire desservir : Palro-num faciunt dos, aedificato, fundis. Ce Droit paroit établi dans les Novelles de Justinien 57, au chap. 2, & dans ant23., au chap. 18. Il étoit dans son egmmencement personnel, Justinien l ’ étendit aux enfans des Fienfaiteurs ; mass depuis il est devenu patrimonial & successif, comme dépendant du fonds ou Fief, auquel il est répute annexé. C ’ est par cette raison qu ’ il peut être algné par venteveéchanpe ou donation ; & il n ’ est pas nécessaire que ces aliénations se fassent avec Paliénation de l ’ université du Fief, il suffit qu ’ elles soient faite ; avec : quelqué dépendance d ’ icelui, comme quelque partie de la rente Seigncunale, à laquelle on voudra annexor le Patronage. De plus, quand le Patro-nagerest : alternatif, un des Patrons peut disposer de la portion qu ’ il a au Patronagé, en faveur de l ’ autre Patron, sans &. joindre aucune partie où dépen-dance de son Fief, parce que cette difposition réunissant le Patronane qui avoit été divisé, le rejoint au fonds de celui au bénéfice duquel il accroit : ce qui éts-jugé par un Arrêt du 2a. Lévrier 163t. En outre, les Patrons peuvent donner-& aumoner à l ’ Eglise leur droit de présenter aux Hénéfices, sans y joindre auoun fonds ou dépondance d ’ un Fief, comme il g ’ induit de l ’ Article CXl. Il qui réserve au donateur, à ses héritiers ou ayans cause au Fief ou Glebe ausquels droit annexé le Patronage, tous ses droits, honoraires dus aux Patrons.",COUTUME DE NORMANDIE.,CHAPITRE CINQUIEME. DE PATRONAGE D ’ ÉGLISE.,introduction
